School Name,URL
SEKOLAH JENIS KEBANGSAAN (CINA) HWA NAN,https://sites.google.com/moe-dl.edu.my/upbmjpwpkl/pencapaian-sekolah-sekolah/sekolah-sekolah-keramat
SEKOLAH JENIS KEBANGSAAN (CINA) LAM LEE,https://sites.google.com/moe-dl.edu.my/stemocns2021sr/mathematics-online
SEKOLAH JENIS KEBANGSAAN (CINA) LI CHUN,https://sites.google.com/moe-dl.edu.my/pbdsegamatv1/sekolah-2021
SEKOLAH JENIS KEBANGSAAN (CINA) PANCHOR,https://sites.google.com/moe-dl.edu.my/dlime/delima-kpm/aplikasi-delima-kpm/
SEKOLAH JENIS KEBANGSAAN (CINA) SIN HWA,https://sites.google.com/moe-dl.edu.my/sjkcchongkuang/%E6%A0%A1%E5%8F%B2-sejarah-sekolah/sejarah-sekolah
SEKOLAH JENIS KEBANGSAAN (CINA) TUNG CHENG,https://sites.google.com/moe-dl.edu.my/kohingsing
SEKOLAH JENIS KEBANGSAAN (CINA) FOON YEW 1,https://sites.google.com/moe-dl.edu.my/e-pengurusansjkcnanya/pengurusan-sekolah/galeri-gambar
SEKOLAH JENIS KEBANGSAAN (CINA) FOON YEW 2,https://sites.google.com/moe-dl.edu.my/e-pengurusansjkcnanya/pengurusan-sekolah/galeri-gambar
SEKOLAH JENIS KEBANGSAAN (CINA) FOON YEW 3,https://sites.google.com/moe-dl.edu.my/e-pengurusansjkcnanya/pengurusan-sekolah/galeri-gambar
SEKOLAH JENIS KEBANGSAAN (CINA) FOON YEW 4,https://sites.google.com/moe-dl.edu.my/e-pengurusansjkcnanya/pengurusan-sekolah/galeri-gambar
SEKOLAH JENIS KEBANGSAAN (CINA) FOON YEW 5,https://sites.google.com/moe-dl.edu.my/e-pengurusansjkcnanya/pengurusan-sekolah/galeri-gambar
SEKOLAH JENIS KEBANGSAAN (CINA) PEI HWA,https://sites.google.com/moe-dl.edu.my/stemocns2021sr/mathematics-online
SEKOLAH JENIS KEBANGSAAN (CINA) CHEE TONG,https://sites.google.com/moe-dl.edu.my/sjkcchongkuang/%E6%A0%A1%E5%8F%B2-sejarah-sekolah/sejarah-sekolah
SEKOLAH JENIS KEBANGSAAN (CINA) PANDAN,https://sites.google.com/moe-dl.edu.my/pdpronline/link-bahan-pdpr-skls1-j/cik-siti-nadia/bm-3-satria
SEKOLAH JENIS KEBANGSAAN (CINA) TIRAM,https://sites.google.com/moe-dl.edu.my/dlime/delima-kpm/aplikasi-delima-kpm/
SEKOLAH JENIS KEBANGSAAN (CINA) JOHOR JAYA,https://sites.google.com/moe-dl.edu.my/stemocns2021sr/mathematics-online
SEKOLAH JENIS KEBANGSAAN (CINA) WOON HWA,https://sites.google.com/moe-dl.edu.my/sjkcchongkuang/%E6%A0%A1%E5%8F%B2-sejarah-sekolah/sejarah-sekolah
SEKOLAH JENIS KEBANGSAAN (CINA) PEI HWA 2,https://sites.google.com/moe-dl.edu.my/stemocns2021sr/mathematics-online
SEKOLAH JENIS KEBANGSAAN (CINA) SENTRAL PALOH,https://sites.google.com/moe-dl.edu.my/dpskmkluang/one-page-report-opr-1-slide-dp-sekolah
SEKOLAH JENIS KEBANGSAAN (CINA) CHIAN BEE,https://sites.google.com/moe-dl.edu.my/dpskmkluang/one-page-report-opr-1-slide-dp-sekolah
SEKOLAH JENIS KEBANGSAAN (CINA) CHIN CHIANG,https://sites.google.com/moe-dl.edu.my/stemocns2021sr/mathematics-online
SEKOLAH JENIS KEBANGSAAN (CINA) CHONG ENG,https://sites.google.com/moe-dl.edu.my/futureskillsforall-microbit/hasil-kerja-murid/pemenang-bolehcode-2021
SEKOLAH JENIS KEBANGSAAN (CINA) CHONG HWA I,https://sites.google.com/moe-dl.edu.my/sjkcchongkuang/%E6%A0%A1%E5%8F%B2-sejarah-sekolah/sejarah-sekolah
SEKOLAH JENIS KEBANGSAAN (CINA) CHONG HWA 2,https://sites.google.com/moe-dl.edu.my/sjkcchongkuang/%E6%A0%A1%E5%8F%B2-sejarah-sekolah/sejarah-sekolah
SEKOLAH JENIS KEBANGSAAN (CINA) CHONG HWA 3,https://sites.google.com/moe-dl.edu.my/chunghwajitra/home/sejarah-sekolah
SEKOLAH JENIS KEBANGSAAN (CINA) KG. GAJAH,https://sites.google.com/moe-dl.edu.my/pdpronline/link-bahan-pdpr-skls1-j/en-yus/matematik-tahun-4
SEKOLAH JENIS KEBANGSAAN (CINA) KAHANG,https://sites.google.com/moe-dl.edu.my/dpskmkluang/one-page-report-opr-1-slide-dp-sekolah
SEKOLAH JENIS KEBANGSAAN (CINA) LIT TERK,https://sites.google.com/moe-dl.edu.my/dpskmkluang/one-page-report-opr-1-slide-dp-sekolah
SEKOLAH JENIS KEBANGSAAN (CINA) PALOH,https://sites.google.com/moe-dl.edu.my/dpskmkluang/one-page-report-opr-1-slide-dp-sekolah
SEKOLAH JENIS KEBANGSAAN (CINA) SAYONG,https://sites.google.com/moe-dl.edu.my/dpskmkluang/one-page-report-opr-1-slide-dp-sekolah
SEKOLAH JENIS KEBANGSAAN (CINA) TUAN POON,https://sites.google.com/moe-dl.edu.my/stemocns2021sr/mathematics-online
SEKOLAH JENIS KEBANGSAAN (CINA) YU MING,https://sites.google.com/moe-dl.edu.my/kolokiumppdhl/2021/utama
SEKOLAH JENIS KEBANGSAAN (CINA) SRI LALANG,https://sites.google.com/moe-dl.edu.my/spbtsmkserilalang/mengenai-kami
SEKOLAH JENIS KEBANGSAAN (CINA) MAWAI,https://sites.google.com/moe-dl.edu.my/e-pengurusansjkcnanya/pengurusan-sekolah/galeri-gambar
SEKOLAH JENIS KEBANGSAAN (CINA) NEW KOTA,https://sites.google.com/moe-dl.edu.my/pdpronline/link-bahan-pdpr-skls1-j/en-wira/moral-tahun-3
SEKOLAH JENIS KEBANGSAAN (CINA) NAN YA,https://sites.google.com/moe-dl.edu.my/e-pengurusansjkcnanya/pengurusan-sekolah/galeri-gambar
SEKOLAH JENIS KEBANGSAAN (CINA) TAI SIN,https://sites.google.com/moe-dl.edu.my/budaya-penyelidikan-melaka/contoh-penulisan
SEKOLAH JENIS KEBANGSAAN (CINA) YU HWA,https://sites.google.com/moe-dl.edu.my/ikoncikgootubekinabalu/senarai-pemenang-anugerah
SEKOLAH JENIS KEBANGSAAN (CINA) AI HWA,https://sites.google.com/moe-dl.edu.my/pbdsegamatv1/sekolah-2021
SEKOLAH JENIS KEBANGSAAN (CINA) BOON LIM,https://sites.google.com/moe-dl.edu.my/sjkcchongkuang/%E6%A0%A1%E5%8F%B2-sejarah-sekolah/sejarah-sekolah
SEKOLAH JENIS KEBANGSAAN (CINA) CHUNG HWA 1 A,https://sites.google.com/moe-dl.edu.my/ikoncikgootubekinabalu/senarai-pemenang-anugerah
SEKOLAH JENIS KEBANGSAAN (CINA) CHUNG HWA 1 B,https://sites.google.com/moe-dl.edu.my/sjkcchongkuang/%E6%A0%A1%E5%8F%B2-sejarah-sekolah/sejarah-sekolah
SEKOLAH JENIS KEBANGSAAN (CINA) CHUNG HWA 2A,https://sites.google.com/moe-dl.edu.my/stemocns2021sr/mathematics-online
SEKOLAH JENIS KEBANGSAAN (CINA) CHUNG HWA 2B,https://sites.google.com/moe-dl.edu.my/ikoncikgootubekinabalu/senarai-pemenang-anugerah
SEKOLAH JENIS KEBANGSAAN (CINA) CHUNG HWA KETIGA,https://sites.google.com/moe-dl.edu.my/ikoncikgootubekinabalu/senarai-pemenang-anugerah
SEKOLAH JENIS KEBANGSAAN (CINA) CHUNG HWA,https://sites.google.com/moe-dl.edu.my/ikoncikgootubekinabalu/senarai-pemenang-anugerah
SEKOLAH JENIS KEBANGSAAN (CINA) HWA MING,https://sites.google.com/moe-dl.edu.my/kolokiumppdhl/2021/utama
SEKOLAH JENIS KEBANGSAAN (CINA) KEPONG,https://sites.google.com/moe-dl.edu.my/portalsmkkepongbaru/home
SEKOLAH JENIS KEBANGSAAN (CINA) PEI YANG,https://sites.google.com/moe-dl.edu.my/e-pengurusansjkcnanya/home
SEKOLAH JENIS KEBANGSAAN (CINA) PENGKALAN BUKIT,https://sites.google.com/moe-dl.edu.my/dpskmkluang/one-page-report-opr-1-slide-dp-sekolah
SEKOLAH JENIS KEBANGSAAN (CINA) PU NAN,https://sites.google.com/moe-dl.edu.my/dpskmkluang/one-page-report-opr-1-slide-dp-sekolah
SEKOLAH JENIS KEBANGSAAN (CINA) SIN MING,https://sites.google.com/moe-dl.edu.my/kolokiumppdhl/2021/utama
SEKOLAH JENIS KEBANGSAAN (CINA) SOON CHENG,https://sites.google.com/moe-dl.edu.my/sjkc-khai-tee/%E7%AE%80%E4%BB%8B-about/%E6%A0%A1%E5%8F%B2-sejarah-sekolah/versi-bahasa-melayu
SEKOLAH JENIS KEBANGSAAN (CINA) SOON MONG,https://sites.google.com/moe-dl.edu.my/sjkcchongkuang/%E6%A0%A1%E5%8F%B2-sejarah-sekolah/sejarah-sekolah
SEKOLAH JENIS KEBANGSAAN (CINA) WEE SIN,https://sites.google.com/moe-dl.edu.my/futureskillsforall-microbit/hasil-kerja-murid/pemenang-bolehcode-2021
SEKOLAH JENIS KEBANGSAAN (CINA) YU ENG,https://sites.google.com/moe-dl.edu.my/ikoncikgootubekinabalu/senarai-pemenang-anugerah
SEKOLAH JENIS KEBANGSAAN (CINA) BIN CHONG,https://sites.google.com/moe-dl.edu.my/e-pengurusansjkcnanya/pengurusan-sekolah/galeri-gambar
SEKOLAH JENIS KEBANGSAAN (CINA) LEE MING,https://sites.google.com/moe-dl.edu.my/panduanpengurusanpss/pertandingan
SEKOLAH JENIS KEBANGSAAN (CINA) PEI CHIAO,https://sites.google.com/moe-dl.edu.my/stemocns2021sr/mathematics-online
SEKOLAH JENIS KEBANGSAAN (CINA) YU MING 1,https://sites.google.com/moe-dl.edu.my/stemocns2021sr/mathematics-online
SEKOLAH JENIS KEBANGSAAN (CINA) YU MING 2,https://sites.google.com/moe-dl.edu.my/kolokiumppdhl/2021/utama
SEKOLAH JENIS KEBANGSAAN (CINA) AI CHUN,https://sites.google.com/moe-dl.edu.my/pbdsegamatv1/sekolah-2021
SEKOLAH JENIS KEBANGSAAN (CINA) BEKOK,https://sites.google.com/moe-dl.edu.my/pbdsegamatv1/sekolah-2021
SEKOLAH JENIS KEBANGSAAN (CINA) CHA'AH,https://sites.google.com/moe-dl.edu.my/pbdsegamatv1/sekolah-2021
SEKOLAH JENIS KEBANGSAAN (CINA) CENTRAL SITE,https://sites.google.com/moe-dl.edu.my/e-pengurusansjkcnanya/home
SEKOLAH JENIS KEBANGSAAN (CINA) TAH KANG,https://sites.google.com/moe-dl.edu.my/pbdsegamatv1/sekolah-2021
SEKOLAH JENIS KEBANGSAAN (CINA) JEMENTAH 1,https://sites.google.com/moe-dl.edu.my/pbdsegamatv1/sekolah-2021
SEKOLAH JENIS KEBANGSAAN (CINA) JABI,https://sites.google.com/moe-dl.edu.my/pbdsegamatv1/sekolah-2021
SEKOLAH JENIS KEBANGSAAN (CINA) JAGOH,https://sites.google.com/moe-dl.edu.my/pbdsegamatv1/sekolah-2021
SEKOLAH JENIS KEBANGSAAN (CINA) LI CHI,https://sites.google.com/moe-dl.edu.my/pbdsegamatv1/sekolah-2021
SEKOLAH JENIS KEBANGSAAN (CINA) KASAP,https://sites.google.com/moe-dl.edu.my/pbdsegamatv1/sekolah-2021
SEKOLAH JENIS KEBANGSAAN (CINA) KARAS,https://sites.google.com/moe-dl.edu.my/pbdsegamatv1/sekolah-2021
SEKOLAH JENIS KEBANGSAAN (CINA) LABIS,https://sites.google.com/moe-dl.edu.my/pbdsegamatv1/sekolah-2021
SEKOLAH JENIS KEBANGSAAN (CINA) SEG HWA,https://sites.google.com/moe-dl.edu.my/pbdsegamatv1/sekolah-2021
SEKOLAH JENIS KEBANGSAAN (CINA) BUKIT SIPUT,https://sites.google.com/moe-dl.edu.my/pbdsegamatv1/sekolah-2021
SEKOLAH JENIS KEBANGSAAN (CINA) KAMPUNG TENGAH,https://sites.google.com/moe-dl.edu.my/pbdsegamatv1/sekolah-2021
SEKOLAH JENIS KEBANGSAAN (CINA) TENANG,https://sites.google.com/moe-dl.edu.my/pdpronline/link-bahan-pdpr-skls1-j/cik-siti-nadia/bm-3-satria
SEKOLAH JENIS KEBANGSAAN (CINA) TAMBANG,https://sites.google.com/moe-dl.edu.my/pbdsegamatv1/sekolah-2021
SEKOLAH JENIS KEBANGSAAN (CINA) TUA OOH,https://sites.google.com/moe-dl.edu.my/pbdsegamatv1/sekolah-2021
SEKOLAH JENIS KEBANGSAAN (CINA) JEMENTAH (2),https://sites.google.com/moe-dl.edu.my/pbdsegamatv1/sekolah-2021
SEKOLAH JENIS KEBANGSAAN (CINA) BATU,https://sites.google.com/moe-dl.edu.my/sjkcyukchyun/%E8%82%B2%E7%BE%A4%E4%B8%BB%E9%A1%B5-home
SEKOLAH JENIS KEBANGSAAN (CINA) SAWIT,https://sites.google.com/moe-dl.edu.my/pdpronline/link-bahan-pdpr-skls1-j/cik-siti-nadia/bm-3-satria
SEKOLAH JENIS KEBANGSAAN (CINA) PEI CHENG,https://sites.google.com/moe-dl.edu.my/stemocns2021sr/mathematics-online
SEKOLAH JENIS KEBANGSAAN (CINA) CHI MING 1,https://sites.google.com/moe-dl.edu.my/stemocns2021sr/mathematics-online
SEKOLAH JENIS KEBANGSAAN (CINA) CHIN JU,https://sites.google.com/moe-dl.edu.my/stemocns2021sr/mathematics-online
SEKOLAH JENIS KEBANGSAAN (CINA) CHI MING (2),https://sites.google.com/moe-dl.edu.my/stemocns2021sr/mathematics-online
SEKOLAH JENIS KEBANGSAAN (CINA) NAN HWA,https://sites.google.com/moe-dl.edu.my/upbmjpwpkl/pencapaian-sekolah-sekolah/sekolah-sekolah-keramat
SEKOLAH JENIS KEBANGSAAN (CINA) PEI ENG,https://sites.google.com/moe-dl.edu.my/stemocns2021sr/mathematics-online
SEKOLAH JENIS KEBANGSAAN (CINA) LIAN HWA,https://sites.google.com/moe-dl.edu.my/chunghwajitra/home/sejarah-sekolah
SEKOLAH JENIS KEBANGSAAN (CINA) KEBUN BAHRU,https://sites.google.com/moe-dl.edu.my/pdpronline/link-bahan-pdpr-skls1-j/cik-siti-nadia/bm-3-satria
SEKOLAH JENIS KEBANGSAAN (TAMIL) SRI GADING,https://sites.google.com/moe-dl.edu.my/ppd-batu-pahat-sains-matematik/laporan-aktiviti/2022
SEKOLAH JENIS KEBANGSAAN (TAMIL) LADANG YONG PENG,https://sites.google.com/moe-dl.edu.my/ppd-batu-pahat-sains-matematik/laporan-aktiviti/2022
SEKOLAH JENIS KEBANGSAAN (TAMIL) JALAN YAHYA AWAL,https://sites.google.com/moe-dl.edu.my/jsmpr/pegawai-penyelaras/sains-panel-penyunting-gatekeepers
SEKOLAH JENIS KEBANGSAAN (TAMIL) LADANG MOUNT AUSTIN,https://sites.google.com/moe-dl.edu.my/sjktmasai/kurikulum
SEKOLAH JENIS KEBANGSAAN (TAMIL) LADANG SG PLENTONG,https://sites.google.com/moe-dl.edu.my/sjktmasai/kurikulum
SEKOLAH JENIS KEBANGSAAN (TAMIL) MASAI,https://sites.google.com/moe-dl.edu.my/jsmpr/pegawai-penyelaras/sains-panel-penyunting-gatekeepers
SEKOLAH JENIS KEBANGSAAN (TAMIL) PASIR GUDANG,https://sites.google.com/moe-dl.edu.my/jsmpr/pegawai-penyelaras/sains-panel-penyunting-gatekeepers
SEKOLAH JENIS KEBANGSAAN (TAMIL) DESA CEMERLANG,https://sites.google.com/moe-dl.edu.my/sjktmasai/kurikulum
SEKOLAH JENIS KEBANGSAAN (TAMIL) LADANG ULU TIRAM,https://sites.google.com/moe-dl.edu.my/stutsukanpermainan/profil
SEKOLAH JENIS KEBANGSAAN (TAMIL) BANDAR SERI ALAM,https://sites.google.com/moe-dl.edu.my/ppd-batu-pahat-sains-matematik/laporan-aktiviti/2022
SEKOLAH JENIS KEBANGSAAN (TAMIL) LADANG ULU REMIS,https://sites.google.com/moe-dl.edu.my/dpskmkluang/one-page-report-opr-1-slide-dp-sekolah
SEKOLAH JENIS KEBANGSAAN (TAMIL) LADANG TUN DR ISMAIL,https://sites.google.com/moe-dl.edu.my/ppd-batu-pahat-sains-matematik/laporan-aktiviti/2022
SEKOLAH JENIS KEBANGSAAN (TAMIL) LADANG SEMBRONG,https://sites.google.com/moe-dl.edu.my/dpskmkluang/one-page-report-opr-1-slide-dp-sekolah
SEKOLAH JENIS KEBANGSAAN (TAMIL) JALAN BUKIT RENGAM,https://sites.google.com/moe-dl.edu.my/sjktmasai/kurikulum
SEKOLAH JENIS KEBANGSAAN (TAMIL) LADANG SOUTHERN MALAY,https://sites.google.com/moe-dl.edu.my/dpskmkluang/one-page-report-opr-1-slide-dp-sekolah
SEKOLAH JENIS KEBANGSAAN (TAMIL) LADANG BUKIT BENUT,https://sites.google.com/moe-dl.edu.my/ppd-batu-pahat-sains-matematik/laporan-aktiviti/2022
SEKOLAH JENIS KEBANGSAAN (TAMIL) LADANG ELAEIS,https://sites.google.com/moe-dl.edu.my/dpskmkluang/one-page-report-opr-1-slide-dp-sekolah
SEKOLAH JENIS KEBANGSAAN (TAMIL) LADANG PAMOL,https://sites.google.com/moe-dl.edu.my/dpskmkluang/one-page-report-opr-1-slide-dp-sekolah
SEKOLAH JENIS KEBANGSAAN (TAMIL) KAHANG BATU 24,https://sites.google.com/moe-dl.edu.my/dpskmkluang/one-page-report-opr-1-slide-dp-sekolah
SEKOLAH JENIS KEBANGSAAN (TAMIL) LADANG NIYOR,https://sites.google.com/moe-dl.edu.my/dpskmkluang/one-page-report-opr-1-slide-dp-sekolah
SEKOLAH JENIS KEBANGSAAN (TAMIL) JALAN TAJUL,https://sites.google.com/moe-dl.edu.my/sjktmasai/kurikulum
SEKOLAH JENIS KEBANGSAAN (TAMIL) LDG SUNGAI PAPAN,https://sites.google.com/moe-dl.edu.my/pdpronline/link-bahan-pdpr-skls1-j/cik-siti-nadia/bm-3-satria
SEKOLAH JENIS KEBANGSAAN (TAMIL) MERSING,https://sites.google.com/moe-dl.edu.my/jsmpr/pegawai-penyelaras/sains-panel-penyunting-gatekeepers
SEKOLAH JENIS KEBANGSAAN (TAMIL) JALAN KHALIDI,https://sites.google.com/moe-dl.edu.my/jsmpr/pegawai-penyelaras/matematik-panel-penyunting-gatekeepers
SEKOLAH JENIS KEBANGSAAN (TAMIL) JALAN PARIT IBRAHIM,https://sites.google.com/moe-dl.edu.my/jsmpr/pegawai-penyelaras/matematik-panel-penyunting-gatekeepers
SEKOLAH JENIS KEBANGSAAN (TAMIL) BEKOK,https://sites.google.com/moe-dl.edu.my/pbdsegamatv1/sekolah-2021
SEKOLAH JENIS KEBANGSAAN (TAMIL) LABIS,https://sites.google.com/moe-dl.edu.my/jsmpr/pegawai-penyelaras/sains-panel-penyunting-gatekeepers
SEKOLAH JENIS KEBANGSAAN (TAMIL) LADANG VOULES,https://sites.google.com/moe-dl.edu.my/pbdsegamatv1/sekolah-2021
SEKOLAH JENIS KEBANGSAAN (TAMIL) LADANG SEGAMAT,https://sites.google.com/moe-dl.edu.my/sjktmasai/kurikulum
SEKOLAH JENIS KEBANGSAAN (TAMIL) BANDAR SEGAMAT,https://sites.google.com/moe-dl.edu.my/sjktmasai/kurikulum
SEKOLAH JENIS KEBANGSAAN (TAMIL) LADANG SG MUAR,https://sites.google.com/moe-dl.edu.my/jsmpr/pegawai-penyelaras/sains-panel-penyunting-gatekeepers
SEKOLAH JENIS KEBANGSAAN (TAMIL) LDG SG SENARUT,https://sites.google.com/moe-dl.edu.my/pbdsegamatv1/sekolah-2021
SEKOLAH JENIS KEBANGSAAN (TAMIL) BATU ANAM,https://sites.google.com/moe-dl.edu.my/cikgumusli/home
SEKOLAH JENIS KEBANGSAAN (TAMIL) LADANG GOMALI,https://sites.google.com/moe-dl.edu.my/pbdsegamatv1/sekolah-2021
SEKOLAH JENIS KEBANGSAAN (TAMIL) LADANG FORTROSE,https://sites.google.com/moe-dl.edu.my/pbdsegamatv1/sekolah-2021
SEKOLAH JENIS KEBANGSAAN (TAMIL) LADANG NAGAPPA,https://sites.google.com/moe-dl.edu.my/pbdsegamatv1/sekolah-2021
SEKOLAH JENIS KEBANGSAAN (TAMIL) CANTUMAN CHAAH,https://sites.google.com/moe-dl.edu.my/pbdsegamatv1/sekolah-2021
SEKOLAH JENIS KEBANGSAAN (TAMIL) LADANG KULAI BESAR,https://sites.google.com/moe-dl.edu.my/jsmpr/pegawai-penyelaras/matematik-panel-penyunting-gatekeepers
SEKOLAH JENIS KEBANGSAAN (TAMIL) LADANG KELAN,https://sites.google.com/moe-dl.edu.my/pdpronline/link-bahan-pdpr-skls1-j/pn-siti-dayana/bm-4-lestari
SEKOLAH JENIS KEBANGSAAN (TAMIL) LADANG BEKOH,https://sites.google.com/moe-dl.edu.my/upbm/eccar/jasin/sekolah-rendah-js
SEKOLAH JENIS KEBANGSAAN (TAMIL) LADANG SAGIL,https://sites.google.com/moe-dl.edu.my/jsmpr/pegawai-penyelaras/sains-panel-penyunting-gatekeepers
SEKOLAH JENIS KEBANGSAAN (TAMIL) LADANG TANAH MERAH,https://sites.google.com/moe-dl.edu.my/panitamatematikdaerahku/sk/sk-seri-mutiara
SEKOLAH KEBANGSAAN PENDIDIKAN KHAS PRINCESS ELIZABETH,https://sites.google.com/moe-dl.edu.my/kolej-ting-6-kota-kinabalu/album
SEKOLAH RENDAH AGAMA BERSEPADU KLUANG,https://sites.google.com/moe-dl.edu.my/datatovetrsr/sk
SEKOLAH RENDAH AGAMA BERSEPADU KOTA TINGGI,https://sites.google.com/moe-dl.edu.my/cikgumusli/home
SEKOLAH MENENGAH KEBANGSAAN DATO' BENTARA LUAR,https://sites.google.com/moe-dl.edu.my/unitbahasaprogram-pso-2021/aktiviti-unit-bahasa/aktiviti-u-bahasa-2022/bulan-sept-2022
SEKOLAH MENENGAH KEBANGSAAN TUN AMINAH,https://sites.google.com/moe-dl.edu.my/koleksi-quiz-smk/home/sains
SEKOLAH MENENGAH KEBANGSAAN SENGGARANG,https://sites.google.com/moe-dl.edu.my/ppki-batu-pahat/utama
SEKOLAH MENENGAH KEBANGSAAN SERI MEDAN,https://sites.google.com/moe-dl.edu.my/smkdd1
SEKOLAH MENENGAH KEBANGSAAN DATO SULAIMAN,https://sites.google.com/moe-dl.edu.my/smkserilalangv50/pibg
SEKOLAH MENENGAH KEBANGSAAN DATO ONN,https://sites.google.com/moe-dl.edu.my/perpustakaandigitalsklb/cinta-malaysia
SEKOLAH MENENGAH KEBANGSAAN PERMATA JAYA,https://sites.google.com/moe-dl.edu.my/sekolah-kebangsaan-haji-mahmud/hal-ehwal-murid/bimbingan-dan-kaunseling/pencapaian-sumbangan
SEKOLAH MENENGAH KEBANGSAAN SERI GADING,https://sites.google.com/moe-dl.edu.my/perpustakaan-digital-sjkcsy/koleksi-rak-buku-maya
SEKOLAH MENENGAH KEBANGSAAN DATIN ONN JAFFAR,https://sites.google.com/moe-dl.edu.my/ppd-batu-pahat-sains-matematik/laporan-aktiviti/2022
SEKOLAH MENENGAH KEBANGSAAN DATO SETH,https://sites.google.com/moe-dl.edu.my/ppd-batu-pahat-sains-matematik/laporan-aktiviti/2022
SEKOLAH MENENGAH KEBANGSAAN BANANG JAYA,https://sites.google.com/moe-dl.edu.my/kemaskiniiddelimakl/home
SEKOLAH MENENGAH SAINS BATU PAHAT,https://sites.google.com/moe-dl.edu.my/ppd-batu-pahat-sains-matematik/profil/norafiza-binti-abdul-rahman
SEKOLAH MENENGAH KEBANGSAAN SURIA PERDANA,https://sites.google.com/moe-dl.edu.my/upbmjpwpkl/pencapaian-sekolah-sekolah/sekolah-sekolah-bangsar
SEKOLAH MENENGAH KEBANGSAAN SULTAN ISMAIL,https://sites.google.com/moe-dl.edu.my/skbatuanamsegamat/organisasi
SEKOLAH MENENGAH KEBANGSAAN SRI RAHMAT,https://sites.google.com/moe-dl.edu.my/unitbahasaprogram-pso-2021/aktiviti-unit-bahasa/aktiviti-u-bahasa-2022/bulan-februari-2022
SEKOLAH MENENGAH KEBANGSAAN PASIR GUDANG,https://sites.google.com/moe-dl.edu.my/upbmjpwpkl/unit-pembangunan-bakat-murid-jpwpkl
SEKOLAH MENENGAH KEBANGSAAN TAMAN JOHOR JAYA (1),https://sites.google.com/moe-dl.edu.my/smkbud2bea8658/laman-utama
SEKOLAH MENENGAH KEBANGSAAN BANDAR BARU UDA,https://sites.google.com/moe-dl.edu.my/link-penting-20222023/home
SEKOLAH MENENGAH KEBANGSAAN TAMAN UNIVERSITI,https://sites.google.com/moe-dl.edu.my/smkbud2bea8658/laman-utama
SEKOLAH MENENGAH KEBANGSAAN TAMAN JOHOR JAYA 2,https://sites.google.com/moe-dl.edu.my/smkbud2bea8658/laman-utama
SEKOLAH MENENGAH KEBANGSAAN TAMAN DAYA,https://sites.google.com/moe-dl.edu.my/upbm/stem/karnival-stem/stem-talent-show-competition
SEKOLAH MENENGAH KEBANGSAAN DAMAI JAYA,https://sites.google.com/moe-dl.edu.my/upbmjpwpkl/pencapaian-sekolah-sekolah/sekolah-sekolah-pudu
SEKOLAH MENENGAH KEBANGSAAN TAMAN DESA JAYA,https://sites.google.com/moe-dl.edu.my/perpustakaan-digital-sjkcsy/koleksi-rak-buku-maya
SEKOLAH MENENGAH KEBANGSAAN SERI KOTA PUTERI,https://sites.google.com/moe-dl.edu.my/pdpronline/link-bahan-pdpr-skls1-j/en-wira/moral-tahun-3
SEKOLAH MENENGAH KEBANGSAAN TAMAN UNIVERSITI 2,https://sites.google.com/moe-dl.edu.my/smkbud2bea8658/laman-utama
SEKOLAH MENENGAH KEBANGSAAN BANDAR SERI ALAM,https://sites.google.com/moe-dl.edu.my/upbm/eccar/melaka-tengah/sekolah-rendah-mt
SEKOLAH MENENGAH KEBANGSAAN DESA CEMERLANG,https://sites.google.com/moe-dl.edu.my/e-pengurusansjkcnanya/pengurusan-sekolah/galeri-gambar
SEKOLAH MENENGAH KEBANGSAAN PASIR PUTIH,https://sites.google.com/moe-dl.edu.my/upbmjpwpkl/unit-pembangunan-bakat-murid-jpwpkl
SEKOLAH MENENGAH KEBANGSAAN TAMAN MOLEK,https://sites.google.com/moe-dl.edu.my/perpustakaan-digital-sjkcsy/koleksi-rak-buku-maya
SEKOLAH MENENGAH KEBANGSAAN SERI ALAM 2,https://sites.google.com/moe-dl.edu.my/upbm/eccar/melaka-tengah/sekolah-rendah-mt
SEKOLAH MENENGAH KEBANGSAAN PUTERI WANGSA,https://sites.google.com/moe-dl.edu.my/upbmjpwpkl/pencapaian-sekolah-sekolah/sekolah-sekolah-keramat
SEKOLAH MENENGAH KEBANGSAAN SERI KOTA PUTERI 2,https://sites.google.com/moe-dl.edu.my/pdpronline/link-bahan-pdpr-skls1-j/en-wira/moral-tahun-3
SEKOLAH MENENGAH KEBANGSAAN TAMAN DAYA 2,https://sites.google.com/moe-dl.edu.my/upbm/stem/karnival-stem/stem-talent-show-competition
SEKOLAH MENENGAH KEBANGSAAN TAMAN BUKIT INDAH,https://sites.google.com/moe-dl.edu.my/smk-hillcrest-gsites/utama
SEKOLAH MENENGAH KEBANGSAAN MOHD KHALID,https://sites.google.com/moe-dl.edu.my/portalskpr/home?authuser=0
SEKOLAH SENI MALAYSIA JOHOR,https://sites.google.com/moe-dl.edu.my/malledubp/pdpr
SEKOLAH MENENGAH KEBANGSAAN SUNGAI TIRAM,https://sites.google.com/moe-dl.edu.my/dlime/delima-kpm/aplikasi-delima-kpm/
SEKOLAH MENENGAH KEBANGSAAN BANDAR UDA UTAMA,https://sites.google.com/moe-dl.edu.my/upbm/stem/karnival-stem/stem-talent-show-competition
SEKOLAH MENENGAH KEBANGSAAN TUN HUSSEIN ONN,https://sites.google.com/moe-dl.edu.my/perpustakaandigitalsklb/cinta-malaysia
SEKOLAH MENENGAH KEBANGSAAN KAHANG,https://sites.google.com/moe-dl.edu.my/smkkahangjea2032/demografik
SEKOLAH MENENGAH KEBANGSAAN TAMAN KLUANG BARAT,https://sites.google.com/moe-dl.edu.my/spbtsmkserilalang/mengenai-kami
SEKOLAH MENENGAH KEBANGSAAN SIMPANG RENGAM,https://sites.google.com/moe-dl.edu.my/fcpi/download
SEKOLAH MENENGAH KEBANGSAAN SERI INTAN,https://sites.google.com/moe-dl.edu.my/pdpronline/link-bahan-pdpr-skls1-j/en-wira/moral-tahun-3
SEKOLAH MENENGAH KEBANGSAAN BANDAR T6,https://sites.google.com/moe-dl.edu.my/ptesmkthammelaka/program-t6/dokumentasi
SEKOLAH MENENGAH KEBANGSAAN JALAN KOTA TINGGI,https://sites.google.com/moe-dl.edu.my/cikgumusli/home
SEKOLAH MENENGAH KEBANGSAAN SERI LALANG,https://sites.google.com/moe-dl.edu.my/smkserilalangv50/pibg
SEKOLAH MENENGAH KEBANGSAAN TAMAN SERI KLUANG,https://sites.google.com/moe-dl.edu.my/smkseriintan/home
SEKOLAH MENENGAH KEBANGSAAN SERI PERDANA,https://sites.google.com/moe-dl.edu.my/kuizonline/quizizz/matematik
SEKOLAH MENENGAH KEBANGSAAN BANDAR KOTA TINGGI,https://sites.google.com/moe-dl.edu.my/mycounselor/kaunseling-kerjaya
SEKOLAH MENENGAH KEBANGSAAN AIR TAWAR,https://sites.google.com/moe-dl.edu.my/dlime/delima-kpm/aplikasi-delima-kpm/
SEKOLAH MENENGAH KEBANGSAAN BANDAR MAS,https://sites.google.com/moe-dl.edu.my/upbm/eccar/melaka-tengah/sekolah-rendah-mt
SEKOLAH MENENGAH KEBANGSAAN BANDAR PENAWAR,https://sites.google.com/moe-dl.edu.my/e-pengurusansjkcnanya/pengurusan-sekolah/galeri-gambar
SEKOLAH MENENGAH SAINS KOTA TINGGI,https://sites.google.com/moe-dl.edu.my/mycounselor/kaunseling-kerjaya
SEKOLAH MENENGAH KEBANGSAAN SERI AMAN,https://sites.google.com/moe-dl.edu.my/pdpronline/link-bahan-pdpr-skls1-j/en-wira/moral-tahun-3
SEKOLAH MENENGAH KEBANGSAAN TAMAN KOTA JAYA,https://sites.google.com/moe-dl.edu.my/upbmjpwpkl/pencapaian-sekolah-sekolah/sekolah-sekolah-keramat
SEKOLAH MENENGAH KEBANGSAAN TAMAN SERI SAUJANA,"https://sites.google.com/moe-dl.edu.my/jeldr/cpd/webinars?google_abuse=GOOGLE_ABUSE_EXEMPTION%3DID%3D9e3954e08915ee94:TM%3D1654809389:C%3D%3E:IP%3D66.249.73.43-:S%3DbiN74AZN9IoDEhfmvm9zGQ%3B+path%3D/%3B+domain%3Dgoogle.com%3B+expires%3DFri,+10-Jun-2022+00:16:29+GMT"
SEKOLAH MENENGAH KEBANGSAAN SULTAN ALAUDDIN,https://sites.google.com/moe-dl.edu.my/unitbahasaprogram-pso-2021/aktiviti-unit-bahasa/aktiviti-u-bahasa-2023/bulan-februari-2023
SEKOLAH MENENGAH KEBANGSAAN BANDAR TENGGARA,https://sites.google.com/moe-dl.edu.my/unitbahasaprogram-pso-2021/aktiviti-unit-bahasa/aktiviti-u-bahasa-2023/bulan-jun-2023
SEKOLAH MENENGAH KEBANGSAAN BANDAR TENGGARA 2,https://sites.google.com/moe-dl.edu.my/unitbahasaprogram-pso-2021/aktiviti-unit-bahasa/aktiviti-u-bahasa-2023/bulan-jun-2023
SEKOLAH MENENGAH KEBANGSAAN SERI PINANG,https://sites.google.com/moe-dl.edu.my/pestapantunperingkatkebangsaan/home
SEKOLAH MENENGAH KEBANGSAAN MERSING,https://sites.google.com/moe-dl.edu.my/pbdmersing/utama
SEKOLAH MENENGAH KEBANGSAAN TAN SRI ABDUL KADIR,https://sites.google.com/moe-dl.edu.my/ppd-batu-pahat-sains-matematik/laporan-aktiviti/2022
SEKOLAH MENENGAH KEBANGSAAN ANJUNG BATU,https://sites.google.com/moe-dl.edu.my/cikgumusli/home
SEKOLAH MENENGAH KEBANGSAAN DATO' SRI AMAR DI RAJA,https://sites.google.com/moe-dl.edu.my/futureskillsforall-microbit/hasil-kerja-murid/pemenang-bolehcode-2021
SEKOLAH MENENGAH KEBANGSAAN TUN PERAK,https://sites.google.com/moe-dl.edu.my/mycounselor/kaunseling-kerjaya
SEKOLAH MENENGAH KEBANGSAAN RAJA MUDA,https://sites.google.com/moe-dl.edu.my/cikgumusli/home
SEKOLAH MENENGAH KEBANGSAAN BUKIT PASIR,https://sites.google.com/moe-dl.edu.my/upbm/eccar/melaka-tengah/sekolah-rendah-mt
SEKOLAH MENENGAH KEBANGSAAN PEKAN BARU MUAR,https://sites.google.com/moe-dl.edu.my/pbdsegamatv1/sekolah-2021
SEKOLAH MENENGAH KEBANGSAAN BUKIT NANING,https://sites.google.com/moe-dl.edu.my/unitbahasaprogram-pso-2021/aktiviti-unit-bahasa/aktiviti-u-bahasa-2023/bulan-februari-2023
SEKOLAH MENENGAH KEBANGSAAN FELCRA BUKIT KEPONG,https://sites.google.com/moe-dl.edu.my/kemaskiniiddelimakl/home
