School Name,URL
SEKOLAH KEBANGSAAN PUTRA,https://sites.google.com/moe-dl.edu.my/stemocns2021sr/mathematics-online
SEKOLAH KEBANGSAAN AMPANG TINGGI,https://sites.google.com/moe-dl.edu.my/kolokiumppdhl/2021/utama
SEKOLAH KEBANGSAAN KAMPONG PARIT,https://sites.google.com/moe-dl.edu.my/fcpi/kemenjadian-murid
SEKOLAH KEBANGSAAN TALANG,https://sites.google.com/moe-dl.edu.my/videokreatiftransisi2020ppdkuk/penyertaan-sekolah-2
SEKOLAH KEBANGSAAN SERI PILAH,https://sites.google.com/moe-dl.edu.my/mycounselor/kaunseling-kerjaya
SEKOLAH KEBANGSAAN TANAH MELINTANG,https://sites.google.com/moe-dl.edu.my/siskap2022-2023/sukan-permainan/sofbol
SEKOLAH KEBANGSAAN KUALA PILAH,https://sites.google.com/moe-dl.edu.my/n9karnivalstem2021-sm/pertandingan-fotografi-alam-semulajadi
SEKOLAH KEBANGSAAN SUNGAI DUA,https://sites.google.com/moe-dl.edu.my/cikgumusli/home
SEKOLAH KEBANGSAAN ULU SUNGAI DUA,https://sites.google.com/moe-dl.edu.my/skpa2/profil-skpa2/lencana-warna-lambang-dan-motto-sekolah
SEKOLAH KEBANGSAAN DATO' INAS,https://sites.google.com/moe-dl.edu.my/nsstemonlinechallange2021sm/physics-online-quiz-challenge
SEKOLAH KEBANGSAAN INAS,https://sites.google.com/moe-dl.edu.my/nsstemonlinechallange2021sm/physics-online-quiz-challenge
SEKOLAH KEBANGSAAN NURI,https://sites.google.com/moe-dl.edu.my/perpustakaandigitalsklb/koleksi-video-video-pdp
SEKOLAH KEBANGSAAN PELANGAI,https://sites.google.com/moe-dl.edu.my/sistempbdbentong/home/sistem-elapor-sk
SEKOLAH KEBANGSAAN TAPAK,https://sites.google.com/moe-dl.edu.my/skmalau/pbd
SEKOLAH KEBANGSAAN PADANG LEBAR,https://sites.google.com/moe-dl.edu.my/stemocns2021sr/mathematics-online
SEKOLAH KEBANGSAAN SI-RUSA,https://sites.google.com/moe-dl.edu.my/pdpronline/link-bahan-pdpr-skls1-j/en-yus/matematik-tahun-4
SEKOLAH KEBANGSAAN CHUAH,https://sites.google.com/moe-dl.edu.my/malledubp/delima
SEKOLAH KEBANGSAAN KG SAWAH,https://sites.google.com/moe-dl.edu.my/pbdsegamatv1/sekolah-2021
SEKOLAH KEBANGSAAN JIMAH,https://sites.google.com/moe-dl.edu.my/pusat-sumber-smk-methodist-acs/eksplorasi-digital/e-book/koleksi-rak-buku-maya-sekolah
SEKOLAH KEBANGSAAN JIMAH BARU,https://sites.google.com/moe-dl.edu.my/pusat-sumber-smk-methodist-acs/eksplorasi-digital/e-book/koleksi-rak-buku-maya-sekolah
SEKOLAH KEBANGSAAN PASIR PANJANG,https://sites.google.com/moe-dl.edu.my/perpustakaan-digital-sk-pedu/rak-buku-maya
SEKOLAH KEBANGSAAN LINGGI,https://sites.google.com/moe-dl.edu.my/laman-rasmi-skaj/pengurusan/maklumat-asas
SEKOLAH KEBANGSAAN LUKUT,https://sites.google.com/moe-dl.edu.my/pusat-sumber-smk-methodist-acs/eksplorasi-digital/e-book/koleksi-rak-buku-maya-sekolah
SEKOLAH KEBANGSAAN KAMPUNG BARU SIRUSA,https://sites.google.com/moe-dl.edu.my/stemocns2021sr/mathematics-online
SEKOLAH KEBANGSAAN INTAN PERDANA,https://sites.google.com/moe-dl.edu.my/cikgumusli/home
SEKOLAH KEBANGSAAN PEDAS,https://sites.google.com/moe-dl.edu.my/pdpronline/link-bahan-pdpr-skls1-j/cik-siti-nadia/bm-3-satria
SEKOLAH KEBANGSAAN KUNDOR,https://sites.google.com/moe-dl.edu.my/upbm/eccar/melaka-tengah/sekolah-rendah-mt
SEKOLAH KEBANGSAAN KAMPONG BATU,https://sites.google.com/moe-dl.edu.my/skpa2/profil-skpa2/lencana-warna-lambang-dan-motto-sekolah
SEKOLAH KEBANGSAAN SALAK NAMA,https://sites.google.com/moe-dl.edu.my/prasekolah-tadika-swasta/home
SEKOLAH KEBANGSAAN PULAU BESAR,https://sites.google.com/moe-dl.edu.my/unitbahasaprogram-pso-2021/aktiviti-unit-bahasa/aktiviti-u-bahasa-2022/bulan-julai-2022
SEKOLAH KEBANGSAAN TUN HAJI ABDUL MALEK,https://sites.google.com/moe-dl.edu.my/ptesmkthammelaka/hem-t6/kehadiran/semak-e-hadir
SEKOLAH KEBANGSAAN KOTA,https://sites.google.com/moe-dl.edu.my/sktanjungaru1/berita-dan-aktiviti/kurikulum
SEKOLAH KEBANGSAAN KAMPONG TANJONG,https://sites.google.com/moe-dl.edu.my/sekolah-kebangsaan-haji-mahmud/korporat/latarbelakang
SEKOLAH KEBANGSAAN DATO SHAH BANDAR REMBAU,https://sites.google.com/moe-dl.edu.my/stemocns2021sr/mathematics-online
SEKOLAH KEBANGSAAN TAMAN SERI REMBAU,https://sites.google.com/moe-dl.edu.my/stemocns2021sr/mathematics-online
SEKOLAH KEBANGSAAN ULU BERANANG,https://sites.google.com/moe-dl.edu.my/stemocns2021sr/mathematics-online
SEKOLAH KEBANGSAAN BATANG BENAR,https://sites.google.com/moe-dl.edu.my/cikgumusli/home
SEKOLAH KEBANGSAAN LABU ULU,https://sites.google.com/moe-dl.edu.my/skpa2/profil-skpa2/lencana-warna-lambang-dan-motto-sekolah
SEKOLAH KEBANGSAAN LABU,https://sites.google.com/moe-dl.edu.my/skpa2/profil-skpa2/lencana-warna-lambang-dan-motto-sekolah
SEKOLAH KEBANGSAAN GADONG JAYA,https://sites.google.com/moe-dl.edu.my/perpustakaan-digital-sk-pedu/e-nilam
SEKOLAH KEBANGSAAN TEMIANG,https://sites.google.com/moe-dl.edu.my/cikgumuofficial/buku-pengurusan-takwim-persekolahan
SEKOLAH KEBANGSAAN RAHANG,https://sites.google.com/moe-dl.edu.my/jsmpr/video-amali-sains/winner-vas-2021
SEKOLAH KEBANGSAAN SERI KELANA,https://sites.google.com/moe-dl.edu.my/perpustakaan-digital-sjkcsy/koleksi-rak-buku-maya
SEKOLAH KEBANGSAAN AMPANGAN,https://sites.google.com/moe-dl.edu.my/rekodanalisis/utama
SEKOLAH KEBANGSAAN PAROI,https://sites.google.com/moe-dl.edu.my/perpustakaan-digital-sk-pedu/e-nilam
SEKOLAH KEBANGSAAN PANTAI,https://sites.google.com/moe-dl.edu.my/smk-nenasi/profail-sekolah/sejarah-smkn
SEKOLAH KEBANGSAAN DATO' BANDAR RASAH,https://sites.google.com/moe-dl.edu.my/stemocns2021sr/mathematics-online
SEKOLAH KEBANGSAAN MAMBAU,https://sites.google.com/moe-dl.edu.my/stemocns2021sr/mathematics-online
SEKOLAH KEBANGSAAN SEGA,https://sites.google.com/moe-dl.edu.my/sktamansegar/utama
SEKOLAH KEBANGSAAN DATUK AKHIR ZAMAN,https://sites.google.com/moe-dl.edu.my/cikgumusli/home
SEKOLAH KEBANGSAAN SENDAYAN,"https://sites.google.com/moe-dl.edu.my/jeldr/cpd/webinars?google_abuse=GOOGLE_ABUSE_EXEMPTION%3DID%3D9e3954e08915ee94:TM%3D1654809389:C%3D%3E:IP%3D66.249.73.43-:S%3DbiN74AZN9IoDEhfmvm9zGQ%3B+path%3D/%3B+domain%3Dgoogle.com%3B+expires%3DFri,+10-Jun-2022+00:16:29+GMT"
SEKOLAH KEBANGSAAN SENAWANG,https://sites.google.com/moe-dl.edu.my/semsis-online/carian-id-delima
SEKOLAH KEBANGSAAN PENDIDIKAN KHAS SEREMBAN,https://sites.google.com/moe-dl.edu.my/stemocns2021sr/mathematics-online
SEKOLAH KEBANGSAAN TAMAN PAROI JAYA,https://sites.google.com/moe-dl.edu.my/perpustakaan-digital-sk-pedu/e-nilam
SEKOLAH KEBANGSAAN TAMAN RASAH JAYA,https://sites.google.com/moe-dl.edu.my/stemocns2021sr/mathematics-online
SEKOLAH KEBANGSAAN TAMAN SRI MAWAR,"https://sites.google.com/moe-dl.edu.my/jeldr/cpd/webinars?google_abuse=GOOGLE_ABUSE_EXEMPTION%3DID%3D9e3954e08915ee94:TM%3D1654809389:C%3D%3E:IP%3D66.249.73.43-:S%3DbiN74AZN9IoDEhfmvm9zGQ%3B+path%3D/%3B+domain%3Dgoogle.com%3B+expires%3DFri,+10-Jun-2022+00:16:29+GMT"
SEKOLAH KEBANGSAAN TAMAN TUANKU JAAFAR,https://sites.google.com/moe-dl.edu.my/skpa2/profil-skpa2/lencana-warna-lambang-dan-motto-sekolah
SEKOLAH KEBANGSAAN KOMPLEKS KLIA,https://sites.google.com/moe-dl.edu.my/nsstemonlinechallange2021sm/physics-online-quiz-challenge
SEKOLAH KEBANGSAAN TAMAN TASIK JAYA,https://sites.google.com/moe-dl.edu.my/pdpronline/link-bahan-pdpr-skls1-j/pn-siti-dayana/bm-5-lestari
SEKOLAH KEBANGSAAN DESA CEMPAKA,https://sites.google.com/moe-dl.edu.my/smkpuchong/berita-aktiviti/mesyuarat-agung-sukan-permainan
SEKOLAH KEBANGSAAN TAMAN SEMARAK,https://sites.google.com/moe-dl.edu.my/skkulai1/kurikulum/hari-alam-sejahtera-2022
SEKOLAH KEBANGSAAN DESA JASMIN,https://sites.google.com/moe-dl.edu.my/brmonline-induk-smkdp/brm-guru/bidang-bahasa
SEKOLAH KEBANGSAAN TAMAN SERI PAGI,https://sites.google.com/moe-dl.edu.my/pdpronline/link-bahan-pdpr-skls1-j/en-azrul/bahasa-melayu-tahun-5
SEKOLAH KEBANGSAAN TAMAN TUANKU JAAFAR 2,https://sites.google.com/moe-dl.edu.my/skpa2/profil-skpa2/lencana-warna-lambang-dan-motto-sekolah
SEKOLAH KEBANGSAAN SEREMBAN 2A,https://sites.google.com/moe-dl.edu.my/stemocns2021sr/mathematics-online
SEKOLAH KEBANGSAAN SEREMBAN 2B,https://sites.google.com/moe-dl.edu.my/smkseremban2/home
SEKOLAH KEBANGSAAN PANCHOR,https://sites.google.com/moe-dl.edu.my/semsis-online/carian-id-delima
SEKOLAH KEBANGSAAN WAWASAN,https://sites.google.com/moe-dl.edu.my/digitalpsssmkbkt/laman-utama
SEKOLAH KEBANGSAAN SEREMBAN JAYA,https://sites.google.com/moe-dl.edu.my/n9karnivalstem2021-sm/solar-oven-challenge
SEKOLAH KEBANGSAAN SEREMBAN JAYA 2,https://sites.google.com/moe-dl.edu.my/n9karnivalstem2021-sm/solar-oven-challenge
SEKOLAH KEBANGSAAN LAVENDER HEIGHTS,https://sites.google.com/moe-dl.edu.my/stemocns2021sr/mathematics-online
SEKOLAH KEBANGSAAN TAMAN WARISAN PUTERI,https://sites.google.com/moe-dl.edu.my/e-pengurusansjkcnanya/pengurusan-sekolah/galeri-gambar
SEKOLAH KEBANGSAAN SENAWANG 3,https://sites.google.com/moe-dl.edu.my/semsis-online/carian-id-delima
SEKOLAH KEBANGSAAN BANDAR ENSTEK,https://sites.google.com/moe-dl.edu.my/ppki-ppi-sped-tds/jalinan-jaringan
SEKOLAH KEBANGSAAN BANDAR SRI SENDAYAN,"https://sites.google.com/moe-dl.edu.my/jeldr/cpd/webinars?google_abuse=GOOGLE_ABUSE_EXEMPTION%3DID%3D9e3954e08915ee94:TM%3D1654809389:C%3D%3E:IP%3D66.249.73.43-:S%3DbiN74AZN9IoDEhfmvm9zGQ%3B+path%3D/%3B+domain%3Dgoogle.com%3B+expires%3DFri,+10-Jun-2022+00:16:29+GMT"
SEKOLAH KEBANGSAAN NILAI IMPIAN,https://sites.google.com/moe-dl.edu.my/pdpronline/link-bahan-pdpr-skls1-j/pn-siti-dayana/bm-4-lestari
SEKOLAH KEBANGSAAN TUNKU SYED SYAABAN,https://sites.google.com/moe-dl.edu.my/stemocns2021sr/mathematics-online
SEKOLAH KEBANGSAAN DATUK ABDULLAH,https://sites.google.com/moe-dl.edu.my/cikgumusli/home
SEKOLAH KEBANGSAAN GEDOK,https://sites.google.com/moe-dl.edu.my/pssskpantaiwplabuan/home
SEKOLAH KEBANGSAAN SUNGAI JERNEH,https://sites.google.com/moe-dl.edu.my/laman-rasmi-skaj/hubungi-kami
SEKOLAH KEBANGSAAN ROKAN,https://sites.google.com/moe-dl.edu.my/portalrasmisksungairokam/home
SEKOLAH KEBANGSAAN (FELDA) PASIR BESAR,https://sites.google.com/moe-dl.edu.my/budaya-penyelidikan-melaka/contoh-penulisan
SEKOLAH KEBANGSAAN KAMPONG LADANG,https://sites.google.com/moe-dl.edu.my/ppd-batu-pahat-sains-matematik/laporan-aktiviti/2022
SEKOLAH KEBANGSAAN GEMAS,https://sites.google.com/moe-dl.edu.my/sk-felda-palong-1-web-sites/unit/kurikulum/prasekolah/mesyuarat/bil-1-2022
SEKOLAH KEBANGSAAN JELAI 2 (FELDA),https://sites.google.com/moe-dl.edu.my/stemocns2021sr/mathematics-online
SEKOLAH KEBANGSAAN JELAI 1,https://sites.google.com/moe-dl.edu.my/stemocns2021sr/mathematics-online
SEKOLAH KEBANGSAAN JELAI 3 (FELDA),https://sites.google.com/moe-dl.edu.my/stemocns2021sr/mathematics-online
SEKOLAH KEBANGSAAN DR. SULAIMAN,https://sites.google.com/moe-dl.edu.my/perpustakaan-digital-sk-pedu/fizikal-pss
SEKOLAH KEBANGSAAN (FELDA) PALONG 12,https://sites.google.com/moe-dl.edu.my/sk-felda-palong-1-web-sites/aktiviti-sekolah/2022/sambutan-maal-hijrah
SEKOLAH KEBANGSAAN SERTING ULU,https://sites.google.com/moe-dl.edu.my/stemocns2021sr/mathematics-online
SEKOLAH KEBANGSAAN SERTING ILIR,https://sites.google.com/moe-dl.edu.my/stemocns2021sr/mathematics-online
SEKOLAH KEBANGSAAN JEMPOL,https://sites.google.com/moe-dl.edu.my/n9karnivalstem2021-sr/stem-talent-show-competition
SEKOLAH KEBANGSAAN ROMPIN,https://sites.google.com/moe-dl.edu.my/semsis-online/carian-id-delima
SEKOLAH KEBANGSAAN AYER HITAM,https://sites.google.com/moe-dl.edu.my/spbtsmkserilalang/mengenai-kami
SEKOLAH KEBANGSAAN SUNGAI LUI,https://sites.google.com/moe-dl.edu.my/budaya-penyelidikan-melaka/contoh-penulisan
SEKOLAH KEBANGSAAN (FELDA) PALONG 1,https://sites.google.com/moe-dl.edu.my/sk-felda-palong-1-web-sites/unit/ko-kurikulum
SEKOLAH KEBANGSAAN (FELDA) PALONG 2,https://sites.google.com/moe-dl.edu.my/sk-felda-palong-1-web-sites/unit/hal-ehwal-murid/pengurusan-hem
SEKOLAH KEBANGSAAN (FELDA) PALONG 3,https://sites.google.com/moe-dl.edu.my/sk-felda-palong-1-web-sites/unit/kurikulum/panitia/muzik
SEKOLAH KEBANGSAAN (FELDA) PALONG 4,https://sites.google.com/moe-dl.edu.my/sk-felda-palong-1-web-sites/unit/kurikulum/prasekolah/pengurusan/garis-panduan
SEKOLAH KEBANGSAAN (FELDA) PALONG 5,https://sites.google.com/moe-dl.edu.my/sk-felda-palong-1-web-sites/unit/kurikulum/pbd/epbd/tapak-pelaporan-kelas
SEKOLAH KEBANGSAAN (FELDA) SERTING,https://sites.google.com/moe-dl.edu.my/sk-felda-palong-1-web-sites/aktiviti-sekolah/2022/pertandingan-bola-jaring-daerah
SEKOLAH KEBANGSAAN (FELDA) PALONG 7,https://sites.google.com/moe-dl.edu.my/sk-felda-palong-1-web-sites/maklumat-organisasi/piagam-sekolah
SEKOLAH KEBANGSAAN (FELDA) PALONG 9,https://sites.google.com/moe-dl.edu.my/sk-felda-palong-1-web-sites/aktiviti-sekolah/2022/penutupan-bulan-kebangsaan
SEKOLAH KEBANGSAAN (FELDA) SERTING HILIR 2,https://sites.google.com/moe-dl.edu.my/stemocns2021sr/mathematics-online
SEKOLAH KEBANGSAAN DATO' PENGHULU LUAK JEMPOL,https://sites.google.com/moe-dl.edu.my/stemocns2021sr/mathematics-online
SEKOLAH KEBANGSAAN PALONG 14,https://sites.google.com/moe-dl.edu.my/sk-felda-palong-1-web-sites/maklumat-organisasi/ts25
SEKOLAH KEBANGSAAN SERTING HILIR KOMPLEKS,https://sites.google.com/moe-dl.edu.my/nsstemonlinechallange2021sm/physics-online-quiz-challenge
SEKOLAH KEBANGSAAN PALONG 8 (FELDA),https://sites.google.com/moe-dl.edu.my/sk-felda-palong-1-web-sites/aktiviti-sekolah/2022/penutupan-bulan-kebangsaan
SEKOLAH KEBANGSAAN UNDANG JELEBU,https://sites.google.com/moe-dl.edu.my/nsstemonlinechallange2021sm/physics-online-quiz-challenge
SEKOLAH KEBANGSAAN TUNKU MUNAWIR,https://sites.google.com/moe-dl.edu.my/nsstemonlinechallange2021sm/physics-online-quiz-challenge
SEKOLAH KEBANGSAAN DATO' IDRIS,https://sites.google.com/moe-dl.edu.my/upbmjpwpkl/pegawai-teknikal
SEKOLAH KEBANGSAAN PORT DICKSON,https://sites.google.com/moe-dl.edu.my/n9karnivalstem2021-sm/pertandingan-fotografi-alam-semulajadi
SEKOLAH KEBANGSAAN KING GEORGE V,https://sites.google.com/moe-dl.edu.my/nsstemonlinechallange2021sm/physics-online-quiz-challenge
SEKOLAH KEBANGSAAN ST PAUL,https://sites.google.com/moe-dl.edu.my/smkdpk/profil/senarai-nama-pengetua
SEKOLAH KEBANGSAAN METHODIST (ACS) SEREMBAN,https://sites.google.com/moe-dl.edu.my/nsstemonlinechallange2021sm/physics-online-quiz-challenge
SEKOLAH KEBANGSAAN PUTERI,https://sites.google.com/moe-dl.edu.my/stemocns2021sr/mathematics-online
SEKOLAH KEBANGSAAN TUANKU ABDUL RAHMAN,https://sites.google.com/moe-dl.edu.my/nsstemonlinechallange2021sm/physics-online-quiz-challenge
SEKOLAH KEBANGSAAN TUNKU BESAR TAMPIN,https://sites.google.com/moe-dl.edu.my/stemocns2021sr/mathematics-online
SEKOLAH KEBANGSAAN ST AIDAN,https://sites.google.com/moe-dl.edu.my/stemocns2021sr/mathematics-online
SEKOLAH JENIS KEBANGSAAN (CINA) KG. BARU PETALING,https://sites.google.com/moe-dl.edu.my/dlime/delima-kpm/aplikasi-delima-kpm/
SEKOLAH JENIS KEBANGSAAN (CINA) CHUNG HUA KUALA PILAH,https://sites.google.com/moe-dl.edu.my/stemocns2021sr/mathematics-online
SEKOLAH JENIS KEBANGSAAN (CINA) CHUNG HUA PORT DICKSON,https://sites.google.com/moe-dl.edu.my/stemocns2021sr/mathematics-online
SEKOLAH JENIS KEBANGSAAN (CINA) CHUNG HUA LUKUT,https://sites.google.com/moe-dl.edu.my/stemocns2021sr/mathematics-online
SEKOLAH JENIS KEBANGSAAN (CINA) CHUNG PIN,https://sites.google.com/moe-dl.edu.my/sjkcchongkuang/%E6%A0%A1%E5%8F%B2-sejarah-sekolah/sejarah-sekolah
SEKOLAH JENIS KEBANGSAAN (CINA) YIK CHIAO,https://sites.google.com/moe-dl.edu.my/stemocns2021sr/mathematics-online
SEKOLAH JENIS KEBANGSAAN (CINA) YIK HWA,https://sites.google.com/moe-dl.edu.my/upbmjpwpkl/pencapaian-sekolah-sekolah/sekolah-sekolah-keramat
SEKOLAH JENIS KEBANGSAAN (CINA) KG BARU TANAH MERAH 'A',https://sites.google.com/moe-dl.edu.my/perpustakaandigitalsklb/pameran-bertema
SEKOLAH JENIS KEBANGSAAN (CINA) TANAH MERAH SITE C,https://sites.google.com/moe-dl.edu.my/chunghwajitra/home/sejarah-sekolah
SEKOLAH JENIS KEBANGSAAN (CINA) PEI HWA PEDAS,https://sites.google.com/moe-dl.edu.my/stemocns2021sr/mathematics-online
SEKOLAH JENIS KEBANGSAAN (CINA) CHUNG HUA,https://sites.google.com/moe-dl.edu.my/kohingsing
SEKOLAH JENIS KEBANGSAAN (CINA) CHI HWA,https://sites.google.com/moe-dl.edu.my/stemocns2021sr/mathematics-online
SEKOLAH JENIS KEBANGSAAN (CINA) SAN MIN,https://sites.google.com/moe-dl.edu.my/upbmjpwpkl/pencapaian-sekolah-sekolah/sekolah-sekolah-pudu
SEKOLAH JENIS KEBANGSAAN (CINA) PEI HUA,https://sites.google.com/moe-dl.edu.my/stemocns2021sr/mathematics-online
SEKOLAH JENIS KEBANGSAAN (CINA) KUO MIN,https://sites.google.com/moe-dl.edu.my/stemocns2021sr/mathematics-online
SEKOLAH JENIS KEBANGSAAN (CINA) SINO ENGLISH,https://sites.google.com/moe-dl.edu.my/stemocns2021sr/mathematics-online
SEKOLAH JENIS KEBANGSAAN (CINA) SIN HUA,https://sites.google.com/moe-dl.edu.my/sjkcchongkuang/%E6%A0%A1%E5%8F%B2-sejarah-sekolah/sejarah-sekolah
SEKOLAH JENIS KEBANGSAAN (CINA) KG BARU RAHANG,https://sites.google.com/moe-dl.edu.my/stemocns2021sr/mathematics-online
SEKOLAH JENIS KEBANGSAAN (CINA) KG BARU MAMBAU,https://sites.google.com/moe-dl.edu.my/stemocns2021sr/mathematics-online
SEKOLAH JENIS KEBANGSAAN (CINA) MIN SHING,https://sites.google.com/moe-dl.edu.my/kohingsing
SEKOLAH JENIS KEBANGSAAN (CINA) TUNG HUA,https://sites.google.com/moe-dl.edu.my/kohingsing
SEKOLAH JENIS KEBANGSAAN (CINA) SUNGAI SALAK,https://sites.google.com/moe-dl.edu.my/stemocns2021sr/mathematics-online
SEKOLAH JENIS KEBANGSAAN (CINA) PUTRA NILAI,https://sites.google.com/moe-dl.edu.my/stemocns2021sr/mathematics-online
SEKOLAH JENIS KEBANGSAAN (CINA) BANDAR SRI SENDAYAN,https://sites.google.com/moe-dl.edu.my/stemocns2021sr/mathematics-online
SEKOLAH JENIS KEBANGSAAN (CINA) CHUNG HUA TAMPIN,https://sites.google.com/moe-dl.edu.my/stemocns2021sr/mathematics-online
SEKOLAH JENIS KEBANGSAAN (CINA) KG BARU TAMPIN,https://sites.google.com/moe-dl.edu.my/stemocns2021sr/mathematics-online
SEKOLAH JENIS KEBANGSAAN (CINA) SIN MIN GEMENCHEH,https://sites.google.com/moe-dl.edu.my/sjkcsmg/SPBT
SEKOLAH JENIS KEBANGSAAN (CINA) KG BARU GEDOK,https://sites.google.com/moe-dl.edu.my/stemocns2021sr/mathematics-online
SEKOLAH JENIS KEBANGSAAN (CINA) BAHAU,https://sites.google.com/moe-dl.edu.my/pdpronline/link-bahan-pdpr-skls1-j/en-azrul/bahasa-melayu-tahun-5
SEKOLAH JENIS KEBANGSAAN (CINA) CHUNG SAN,https://sites.google.com/moe-dl.edu.my/kohingsing
SEKOLAH JENIS KEBANGSAAN (TAMIL) KUALA PILAH,https://sites.google.com/moe-dl.edu.my/pbl-stem-bersepadu/editor
SEKOLAH JENIS KEBANGSAAN (TAMIL) PORT DICKSON,https://sites.google.com/moe-dl.edu.my/pbl-stem-bersepadu/editor
SEKOLAH JENIS KEBANGSAAN (TAMIL) LADANG TANAH MERAH,https://sites.google.com/moe-dl.edu.my/panitamatematikdaerahku/sk/sk-seri-mutiara
SEKOLAH JENIS KEBANGSAAN (TAMIL) BANDAR SPRING HILL,https://sites.google.com/moe-dl.edu.my/stemocns2021sr/mathematics-online
SEKOLAH JENIS KEBANGSAAN (TAMIL) SUNGAI SALAK,https://sites.google.com/moe-dl.edu.my/stemocns2021sr/mathematics-online
SEKOLAH JENIS KEBANGSAAN (TAMIL) MUKUNDAN,https://sites.google.com/moe-dl.edu.my/sjktmukundan1
SEKOLAH JENIS KEBANGSAAN (TAMIL) LADANG BATU HAMPAR,https://sites.google.com/moe-dl.edu.my/pbdsegamatv1/sekolah-2021
SEKOLAH JENIS KEBANGSAAN (TAMIL) LADANG SG BARU,https://sites.google.com/moe-dl.edu.my/panitamatematikdaerahku/sk/sk-seri-mutiara
SEKOLAH JENIS KEBANGSAAN (TAMIL) NILAI,https://sites.google.com/moe-dl.edu.my/pdpronline/link-bahan-pdpr-skls1-j/pn-norizan/mt-thn-4
SEKOLAH JENIS KEBANGSAAN (TAMIL) DESA CEMPAKA,https://sites.google.com/moe-dl.edu.my/stemocns2021sr/mathematics-online
SEKOLAH JENIS KEBANGSAAN (TAMIL) RANTAU,https://sites.google.com/moe-dl.edu.my/upbm/eccar/alor-gajah/sekolah-rendah-ag
SEKOLAH JENIS KEBANGSAAN (TAMIL) LADANG LENGGENG,https://sites.google.com/moe-dl.edu.my/dlime/delima-kpm/aplikasi-delima-kpm/
SEKOLAH JENIS KEBANGSAAN (TAMIL) BANDAR SRI SENDAYAN,https://sites.google.com/moe-dl.edu.my/stemocns2021sr/mathematics-online
SEKOLAH JENIS KEBANGSAAN (TAMIL) TAMPIN,https://sites.google.com/moe-dl.edu.my/perpustakaandigitalsklb/koleksi-setempat-sk-lesong-batu
SEKOLAH JENIS KEBANGSAAN (TAMIL) LADANG REGENT,https://sites.google.com/moe-dl.edu.my/sjktmasai/kurikulum
SEKOLAH JENIS KEBANGSAAN (TAMIL) LADANG SG KELAMAH,https://sites.google.com/moe-dl.edu.my/dlime/delima-kpm/aplikasi-delima-kpm/
SEKOLAH JENIS KEBANGSAAN (TAMIL) LDG BAHAU,https://sites.google.com/moe-dl.edu.my/stemocns2021sr/mathematics-online
SEKOLAH JENIS KEBANGSAAN (TAMIL) LDG JERAM PADANG,https://sites.google.com/moe-dl.edu.my/upbm/eccar/alor-gajah/sekolah-rendah-ag
SEKOLAH KEBANGSAAN CHEMBONG,https://sites.google.com/moe-dl.edu.my/perpustakaandigitalsklb/koleksi-setempat-sk-lesong-batu
SEKOLAH KEBANGSAAN UNDANG REMBAU,https://sites.google.com/moe-dl.edu.my/nsstemonlinechallange2021sm/physics-online-quiz-challenge
SEKOLAH KEBANGSAAN BATU KIKIR,https://sites.google.com/moe-dl.edu.my/sk-felda-palong-1-web-sites/aktiviti-sekolah/2022/kem-bestari-solat
SEKOLAH MENENGAH KEBANGSAAN DATO' UNDANG MUSA AL-HAJ,https://sites.google.com/moe-dl.edu.my/nsstemonlinechallange2021sm/physics-online-quiz-challenge
SEKOLAH MENENGAH KEBANGSAAN ZABA,https://sites.google.com/moe-dl.edu.my/upbmsukan/sekolah-sukan-negeri/frofile-sekolah-ssn
SEKOLAH MENENGAH KEBANGSAAN RAJA JUMAAT,https://sites.google.com/moe-dl.edu.my/cikgumusli/home
SEKOLAH MENENGAH KEBANGSAAN DATUK HAJI ABDUL SAMAD,https://sites.google.com/moe-dl.edu.my/nsstemonlinechallange2021sm/physics-online-quiz-challenge
SEKOLAH MENENGAH KEBANGSAAN INTAN PERDANA,https://sites.google.com/moe-dl.edu.my/cikgumusli/home
SEKOLAH MENENGAH KEBANGSAAN DATO' SEDIA RAJA,https://sites.google.com/moe-dl.edu.my/sehebat/home/sejarah-am
SEKOLAH MENENGAH KEBANGSAAN DATO' UNDANG HAJI ADNAN,https://sites.google.com/moe-dl.edu.my/nsstemonlinechallange2021sm/physics-online-quiz-challenge
SEKOLAH MENENGAH SAINS REMBAU,https://sites.google.com/moe-dl.edu.my/n9karnivalstem2021-sr/stem-talent-show-competition
SEKOLAH MENENGAH KEBANGSAAN TUNKU AMPUAN DURAH,https://sites.google.com/moe-dl.edu.my/nsstemonlinechallange2021sm/physics-online-quiz-challenge
SEKOLAH MENENGAH KEBANGSAAN BUKIT MEWAH,https://sites.google.com/moe-dl.edu.my/nsstemonlinechallange2021sm/physics-online-quiz-challenge
SEKOLAH MENENGAH KEBANGSAAN DATO' SHAHARDIN,https://sites.google.com/moe-dl.edu.my/smkdatoshahardin/halaman-utama
SEKOLAH MENENGAH KEBANGSAAN SENAWANG,https://sites.google.com/moe-dl.edu.my/semsis-online/carian-id-delima
SEKOLAH MENENGAH KEBANGSAAN PENDETA ZA'BA,https://sites.google.com/moe-dl.edu.my/upbmsukan/sekolah-sukan-negeri/frofile-sekolah-ssn
SEKOLAH MENENGAH KEBANGSAAN KOMPLEKS KLIA,https://sites.google.com/moe-dl.edu.my/nsstemonlinechallange2021sm/physics-online-quiz-challenge
SEKOLAH MENENGAH KEBANGSAAN DESA CEMPAKA,https://sites.google.com/moe-dl.edu.my/smkpuchong/berita-aktiviti/mesyuarat-agung-sukan-permainan
SEKOLAH MENENGAH KEBANGSAAN TAMAN SEMARAK,https://sites.google.com/moe-dl.edu.my/unitbahasaprogram-pso-2021/aktiviti-unit-bahasa/aktiviti-u-bahasa-2023/bulan-februari-2023
SEKOLAH MENENGAH KEBANGSAAN SERI PAGI,https://sites.google.com/moe-dl.edu.my/unitbahasaprogram-pso-2021/aktiviti-unit-bahasa/aktiviti-u-bahasa-2022/bulan-februari-2022
SEKOLAH MENENGAH SAINS TUANKU MUNAWIR,https://sites.google.com/moe-dl.edu.my/belajargcsifukz/e-rph-gc/sekolah-bimbingan-e-rph-gc
SEKOLAH MENENGAH KEBANGSAAN SEREMBAN 2,https://sites.google.com/moe-dl.edu.my/n9karnivalstem2021-sr/stem-talent-show-competition
SEKOLAH MENENGAH KEBANGSAAN PANCHOR,https://sites.google.com/moe-dl.edu.my/semsis-online/carian-id-delima
SEKOLAH MENENGAH KEBANGSAAN SEREMBAN JAYA,https://sites.google.com/moe-dl.edu.my/n9karnivalstem2021-sm/solar-oven-challenge
SEKOLAH MENENGAH KEBANGSAAN SEREMBAN JAYA 2,https://sites.google.com/moe-dl.edu.my/n9karnivalstem2021-sm/solar-oven-challenge
SEKOLAH MENENGAH KEBANGSAAN WARISAN PUTERI,https://sites.google.com/moe-dl.edu.my/smkpuchong/kurikulum/program-tuisyen-rakyat-selangor
SEKOLAH MENENGAH KEBANGSAAN SEREMBAN 3,https://sites.google.com/moe-dl.edu.my/pdpronline/link-bahan-pdpr-skls1-j/en-wira/moral-tahun-3
SEKOLAH MENENGAH SAINS TUANKU AISHAH ROHANI,https://sites.google.com/moe-dl.edu.my/belajargcsifukz/e-rph-gc/sekolah-bimbingan-e-rph-gc
SEKOLAH MENENGAH KEBANGSAAN CHAN WA II,https://sites.google.com/moe-dl.edu.my/nsstemonlinechallange2021sm/physics-online-quiz-challenge
SEKOLAH MENENGAH KEBANGSAAN NILAI IMPIAN,https://sites.google.com/moe-dl.edu.my/cikgumusli/home
SEKOLAH MENENGAH KEBANGSAAN PASIR BESAR,https://sites.google.com/moe-dl.edu.my/upbm/eccar/melaka-tengah/sekolah-rendah-mt
SEKOLAH MENENGAH KEBANGSAAN TAMAN INDAH,https://sites.google.com/moe-dl.edu.my/smk-hillcrest-gsites/utama
SEKOLAH MENENGAH KEBANGSAAN BAHAU,https://sites.google.com/moe-dl.edu.my/upbmjpwpkl/carta-organisasi/pejabat-pendidikan-daerah-sentul
SEKOLAH MENENGAH KEBANGSAAN SERTING HILIR KOMPLEKS,https://sites.google.com/moe-dl.edu.my/nsstemonlinechallange2021sm/physics-online-quiz-challenge
SEKOLAH MENENGAH KEBANGSAAN BAHAU 2,https://sites.google.com/moe-dl.edu.my/upbmjpwpkl/carta-organisasi/pejabat-pendidikan-daerah-sentul
SEKOLAH MENENGAH KEBANGSAAN UNDANG JELEBU,https://sites.google.com/moe-dl.edu.my/nsstemonlinechallange2021sm/physics-online-quiz-challenge
SEKOLAH MENENGAH KEBANGSAAN TUANKU MUHAMMAD,https://sites.google.com/moe-dl.edu.my/portal-sm-sains-tuanku-aishah-/home
SEKOLAH MENENGAH KEBANGSAAN TUNKU KURSHIAH,https://sites.google.com/moe-dl.edu.my/portal-sm-sains-tuanku-aishah-/home
SEKOLAH MENENGAH KEBANGSAAN CHUNG HUA,https://sites.google.com/moe-dl.edu.my/pertandingan-video-kreatif
SEKOLAH MENENGAH KEBANGSAAN TINGGI PORT DICKSON,https://sites.google.com/moe-dl.edu.my/n9karnivalstem2021-sm/pertandingan-inovasi-stem
SEKOLAH MENENGAH KEBANGSAAN UNDANG REMBAU,https://sites.google.com/moe-dl.edu.my/nsstemonlinechallange2021sm/physics-online-quiz-challenge
SEKOLAH MENENGAH KEBANGSAAN KING GEORGE V,https://sites.google.com/moe-dl.edu.my/nsstemonlinechallange2021sm/physics-online-quiz-challenge
SEKOLAH MENENGAH KEBANGSAAN ST PAUL,https://sites.google.com/moe-dl.edu.my/smkdpk/profil/senarai-nama-pengetua
SEKOLAH MENENGAH KEBANGSAAN METHODIST ACS,https://sites.google.com/moe-dl.edu.my/upbm/eccar/melaka-tengah/sekolah-rendah-mt
