School Name,URL
SEKOLAH MENENGAH KEBANGSAAN DAMANSARA JAYA,https://sites.google.com/moe-dl.edu.my/smkbud2bea8658/laman-utama
SEKOLAH MENENGAH KEBANGSAAN KUALA KUBU BHARU,https://sites.google.com/moe-dl.edu.my/kolej-ting-6-kota-kinabalu/album
SEKOLAH MENENGAH KEBANGSAAN BUKIT SENTOSA,https://sites.google.com/moe-dl.edu.my/kemaskiniiddelimakl/home
SEKOLAH MENENGAH SAINS HULU SELANGOR,https://sites.google.com/moe-dl.edu.my/kokusekuat/pencapaian-kokurikulum-dan-ko-akademik-sekuat/peringkat-daerah
SEKOLAH MENENGAH KEBANGSAAN AMPANG PECAH,https://sites.google.com/moe-dl.edu.my/siskap2022-2023/kelab-persatuan/agama-islam
SEKOLAH MENENGAH KEBANGSAAN TAMAN BUNGA RAYA (1),https://sites.google.com/moe-dl.edu.my/smkpadangtengku/bimbingan-dan-kaunseling/laman-interaktif-minda-sihat
SEKOLAH MENENGAH KEBANGSAAN SERENDAH,https://sites.google.com/moe-dl.edu.my/malledubp/delima
SEKOLAH MENENGAH KEBANGSAAN BUKIT SENTOSA 2,https://sites.google.com/moe-dl.edu.my/kemaskiniiddelimakl/home
SEKOLAH MENENGAH KEBANGSAAN MUNSHI ABDULLAH,https://sites.google.com/moe-dl.edu.my/unitbahasaprogram-pso-2021/aktiviti-unit-bahasa/aktiviti-u-bahasa-2023/bulan-januari-2023
SEKOLAH MENENGAH KEBANGSAAN SUNGAI BESAR,https://sites.google.com/moe-dl.edu.my/cikgumusli/home
SEKOLAH MENENGAH KEBANGSAAN GOMBAK SETIA,"https://sites.google.com/moe-dl.edu.my/jeldr/cpd/webinars?google_abuse=GOOGLE_ABUSE_EXEMPTION%3DID%3D9e3954e08915ee94:TM%3D1654809389:C%3D%3E:IP%3D66.249.73.43-:S%3DbiN74AZN9IoDEhfmvm9zGQ%3B+path%3D/%3B+domain%3Dgoogle.com%3B+expires%3DFri,+10-Jun-2022+00:16:29+GMT"
SEKOLAH MENENGAH KEBANGSAAN TAMAN SELAYANG,"https://sites.google.com/moe-dl.edu.my/jeldr/cpd/webinars?google_abuse=GOOGLE_ABUSE_EXEMPTION%3DID%3D9e3954e08915ee94:TM%3D1654809389:C%3D%3E:IP%3D66.249.73.43-:S%3DbiN74AZN9IoDEhfmvm9zGQ%3B+path%3D/%3B+domain%3Dgoogle.com%3B+expires%3DFri,+10-Jun-2022+00:16:29+GMT"
SEKOLAH MENENGAH KEBANGSAAN TAMAN EHSAN,https://sites.google.com/moe-dl.edu.my/digitalpsssmkbkt/laman-utama
SEKOLAH MENENGAH KEBANGSAAN RAWANG,https://sites.google.com/moe-dl.edu.my/skbtp
SEKOLAH MENENGAH KEBANGSAAN TAMAN KERAMAT,https://sites.google.com/moe-dl.edu.my/upbmjpwpkl/pegawai-teknikal/teknikal-ko-akademik-bahasa-melayu
SEKOLAH MENENGAH KEBANGSAAN SERI GOMBAK,https://sites.google.com/moe-dl.edu.my/kuizonline/quizizz/matematik
SEKOLAH MENENGAH KEBANGSAAN HILLCREST,https://sites.google.com/moe-dl.edu.my/smk-hillcrest-gsites/utama
SEKOLAH MENENGAH KEBANGSAAN TAMAN MELAWATI,https://sites.google.com/moe-dl.edu.my/smk-hillcrest-gsites/utama
SEKOLAH MENENGAH KEBANGSAAN SERI SELAYANG,https://sites.google.com/moe-dl.edu.my/pusat-sumber-smk-methodist-acs/eksplorasi-digital/e-book/koleksi-rak-buku-maya-sekolah
SEKOLAH MENENGAH KEBANGSAAN SUNGAI KERTAS,https://sites.google.com/moe-dl.edu.my/unitbahasaprogram-pso-2021/aktiviti-unit-bahasa/aktiviti-u-bahasa-2023/bulan-april-2023
SEKOLAH MENENGAH KEBANGSAAN SERI KERAMAT,https://sites.google.com/moe-dl.edu.my/ppdpekan/utama
SEKOLAH MENENGAH KEBANGSAAN DARUL EHSAN,https://sites.google.com/moe-dl.edu.my/digitalpsssmkbkt/laman-utama
SEKOLAH MENENGAH KEBANGSAAN TAMAN DESA,https://sites.google.com/moe-dl.edu.my/upbmjpwpkl/pencapaian-sekolah-sekolah/sekolah-sekolah-keramat
SEKOLAH MENENGAH KEBANGSAAN BANDAR TASIK PUTERI,https://sites.google.com/moe-dl.edu.my/perpustakaan-digital-sjkcsy/koleksi-rak-buku-maya
SEKOLAH MENENGAH KEBANGSAAN BUKIT RAHMAN PUTRA,https://sites.google.com/moe-dl.edu.my/ppd-batu-pahat-sains-matematik/laporan-aktiviti/2022
SEKOLAH MENENGAH KEBANGSAAN TAMAN DESA 2,https://sites.google.com/moe-dl.edu.my/smkabakatawau/laman-utama
SEKOLAH MENENGAH KEBANGSAAN SIERRAMAS,https://sites.google.com/moe-dl.edu.my/i-sel-nilam/home/sabak-bernam
SEKOLAH MENENGAH KEBANGSAAN TUN PERAK,https://sites.google.com/moe-dl.edu.my/unitbahasaprogram-pso-2021/aktiviti-unit-bahasa/aktiviti-u-bahasa-2022/bulan-julai-2022
SEKOLAH MENENGAH KEBANGSAAN PUCHONG,https://sites.google.com/moe-dl.edu.my/smkpuchong/berita-aktiviti/aktiviti-program-minggu-pertama-persekolahan
SEKOLAH MENENGAH KEBANGSAAN SRI PERMATA,https://sites.google.com/moe-dl.edu.my/sekolah-kebangsaan-haji-mahmud/korporat/latarbelakang
SEKOLAH MENENGAH KEBANGSAAN SUBANG JAYA,https://sites.google.com/moe-dl.edu.my/i-sel-nilam/home/petaling-perdana
SEKOLAH MENENGAH KEBANGSAAN BUKIT GADING,https://sites.google.com/moe-dl.edu.my/perpustakaan-digital-sjkcsy/koleksi-rak-buku-maya
SEKOLAH MENENGAH KEBANGSAAN SERI SERDANG,https://sites.google.com/moe-dl.edu.my/futureskillsforall-microbit/hasil-kerja-murid/pemenang-bolehcode-2021
SEKOLAH MENENGAH KEBANGSAAN TAMAN DATO' HARUN,https://sites.google.com/moe-dl.edu.my/jeldr/cpd/webinars
KOLEJ TINGKATAN ENAM PUCHONG,https://sites.google.com/moe-dl.edu.my/osct6my/
SEKOLAH MENENGAH KEBANGSAAN DAMANSARA UTAMA,https://sites.google.com/moe-dl.edu.my/smkdd1
SEKOLAH MENENGAH PENDIDIKAN KHAS VOKASIONAL SHAH ALAM,https://sites.google.com/moe-dl.edu.my/smkpuchong/kokurikulum/pencapaian/pertandingan-reka-konsep-misi-malaysia-ke-marikh-2035
SEKOLAH MENENGAH KEBANGSAAN SUBANG UTAMA,https://sites.google.com/moe-dl.edu.my/i-sel-nilam/home/petaling-perdana
SEKOLAH MENENGAH KEBANGSAAN KELANA JAYA,https://sites.google.com/moe-dl.edu.my/perpustakaan-digital-sjkcsy/koleksi-rak-buku-maya
SEKOLAH MENENGAH KEBANGSAAN SEKSYEN SEBELAS,https://sites.google.com/moe-dl.edu.my/upbm/buku-pengurusan-kokurikulum/definisi-kokurikulum
SEKOLAH MENENGAH KEBANGSAAN SEKSYEN 18,https://sites.google.com/moe-dl.edu.my/upbm/buku-pengurusan-kokurikulum/definisi-kokurikulum
SEKOLAH MENENGAH KEBANGSAAN SEAFIELD,https://sites.google.com/moe-dl.edu.my/i-sel-nilam/home/sabak-bernam
KOLEJ TINGKATAN ENAM SHAH ALAM,https://sites.google.com/moe-dl.edu.my/ktesa/kurikulum/carta-organisasi
SEKOLAH MENENGAH KEBANGSAAN SEKSYEN 19,https://sites.google.com/moe-dl.edu.my/upbm/buku-pengurusan-kokurikulum/definisi-kokurikulum
SEKOLAH MENENGAH KEBANGSAAN ALAM MEGAH,https://sites.google.com/moe-dl.edu.my/skkulai1/kokurikulum/bola-sepak-zon-bandar
SEKOLAH MENENGAH KEBANGSAAN TAMAN SRI MUDA,https://sites.google.com/moe-dl.edu.my/upbmjpwpkl/pencapaian-sekolah-sekolah/sekolah-sekolah-keramat
SEKOLAH MENENGAH KEBANGSAAN SRI UTAMA,https://sites.google.com/moe-dl.edu.my/smk-seri-mutiara/pengurusan/buku-pengurusan
SEKOLAH MENENGAH KEBANGSAAN SERI INDAH,https://sites.google.com/moe-dl.edu.my/pusat-sumber-smk-methodist-acs/eksplorasi-digital/e-book/koleksi-rak-buku-maya-sekolah
SEKOLAH MENENGAH KEBANGSAAN PUCHONG PERDANA,https://sites.google.com/moe-dl.edu.my/smkpuchong/berita-aktiviti/kejohanan-sukan-tahunan-kali-ke-38-2022
SEKOLAH MENENGAH KEBANGSAAN SEKSYEN 9,https://sites.google.com/moe-dl.edu.my/smkjalanempat/pentadbiran/latar-belakang-sekolah
SEKOLAH MENENGAH KEBANGSAAN SUBANG,https://sites.google.com/moe-dl.edu.my/i-sel-nilam/home/petaling-perdana
KOLEJ TINGKATAN ENAM BANDAR UTAMA,https://sites.google.com/moe-dl.edu.my/reach-smart-kte/e-rujukan
SEKOLAH MENENGAH KEBANGSAAN USJ 4,https://sites.google.com/moe-dl.edu.my/smkpuchong/kokurikulum/pencapaian/kejohanan-olahraga-pendidikan-khas-mssd-petaling-perdana
SEKOLAH MENENGAH KEBANGSAAN PUCHONG UTAMA (1),https://sites.google.com/moe-dl.edu.my/smkpuchong/berita-aktiviti/mesyuarat-agung-sukan-permainan
SEKOLAH MENENGAH KEBANGSAAN TTDI JAYA,https://sites.google.com/moe-dl.edu.my/smk-bukit-jelutong/
SEKOLAH MENENGAH KEBANGSAAN SEKSYEN 1 BANDAR KINRARA,https://sites.google.com/moe-dl.edu.my/mycounselor/kaunseling-kerjaya
SEKOLAH MENENGAH KEBANGSAAN TROPICANA,https://sites.google.com/moe-dl.edu.my/cbn/gallery/school-song
SEKOLAH MENENGAH KEBANGSAAN BANDAR SRI DAMANSARA 2,https://sites.google.com/moe-dl.edu.my/upbmjpwpkl/pencapaian-sekolah-sekolah/sekolah-sekolah-bangsar
SEKOLAH MENENGAH KEBANGSAAN USJ 23,https://sites.google.com/moe-dl.edu.my/smkpuchong/kokurikulum/pencapaian/kejohanan-olahraga-pendidikan-khas-mssd-petaling-perdana
SEKOLAH MENENGAH KEBANGSAAN BANDAR UTAMA DAMANSARA 3,https://sites.google.com/moe-dl.edu.my/smkbud2bea8658/laman-utama
SEKOLAH MENENGAH KEBANGSAAN BANDAR UTAMA DAMANSARA (4),https://sites.google.com/moe-dl.edu.my/smkbud2bea8658/laman-utama
SEKOLAH MENENGAH KEBANGSAAN SEKSYEN 3 BANDAR KINRARA,https://sites.google.com/moe-dl.edu.my/mycounselor/kaunseling-kerjaya
SEKOLAH MENENGAH KEBANGSAAN SEKSYEN 4 BANDAR KINRARA,https://sites.google.com/moe-dl.edu.my/mycounselor/kaunseling-kerjaya
SEKOLAH MENENGAH KEBANGSAAN SEKSYEN 7,https://sites.google.com/moe-dl.edu.my/mycounselor/kaunseling-kerjaya
SEKOLAH MENENGAH KEBANGSAAN PUSAT BANDAR PUCHONG 1,https://sites.google.com/moe-dl.edu.my/perpustakaan-digital-sjkcsy/koleksi-rak-buku-maya
SEKOLAH MENENGAH KEBANGSAAN BUKIT JELUTONG,https://sites.google.com/moe-dl.edu.my/smk-bukit-jelutong/
SEKOLAH MENENGAH KEBANGSAAN DAMANSARA DAMAI 1,https://sites.google.com/moe-dl.edu.my/smkdd1
SEKOLAH MENENGAH KEBANGSAAN ALAM MEGAH 2,https://sites.google.com/moe-dl.edu.my/skkulai1/kokurikulum/bola-sepak-zon-bandar
SEKOLAH MENENGAH KEBANGSAAN SEKSYEN 24 (2),https://sites.google.com/moe-dl.edu.my/pbd-smks242/paparan-utama
SEKOLAH MENENGAH KEBANGSAAN BANDAR PUCHONG JAYA (A),https://sites.google.com/moe-dl.edu.my/perpustakaan-digital-sjkcsy/koleksi-rak-buku-maya
SEKOLAH MENENGAH KEBANGSAAN BANDAR PUCHONG JAYA (B),https://sites.google.com/moe-dl.edu.my/smk-bukit-jelutong/
SEKOLAH MENENGAH KEBANGSAAN BANDAR UTAMA DAMANSARA (2),https://sites.google.com/moe-dl.edu.my/smkbud2bea8658/laman-utama
SEKOLAH MENENGAH KEBANGSAAN BANDAR SRI DAMANSARA 1,https://sites.google.com/moe-dl.edu.my/upbmjpwpkl/pencapaian-sekolah-sekolah/sekolah-sekolah-bangsar
SEKOLAH MENENGAH KEBANGSAAN SEKSYEN 27,https://sites.google.com/moe-dl.edu.my/mycounselor/kaunseling-kerjaya
SEKOLAH MENENGAH KEBANGSAAN PUCHONG PERMAI,https://sites.google.com/moe-dl.edu.my/smkpuchong/kokurikulum/pencapaian/the-core-dan-elite-kejohanan-kabaddi-mssd-petaling-perdana-2022
SEKOLAH MENENGAH KEBANGSAAN DAMANSARA JAYA,https://sites.google.com/moe-dl.edu.my/smkbud2bea8658/laman-utama
SEKOLAH MENENGAH KEBANGSAAN KUALA KUBU BHARU,https://sites.google.com/moe-dl.edu.my/kolej-ting-6-kota-kinabalu/album
SEKOLAH MENENGAH KEBANGSAAN BUKIT SENTOSA,https://sites.google.com/moe-dl.edu.my/kemaskiniiddelimakl/home
SEKOLAH MENENGAH SAINS HULU SELANGOR,https://sites.google.com/moe-dl.edu.my/kokusekuat/pencapaian-kokurikulum-dan-ko-akademik-sekuat/peringkat-daerah
SEKOLAH MENENGAH KEBANGSAAN AMPANG PECAH,https://sites.google.com/moe-dl.edu.my/siskap2022-2023/kelab-persatuan/agama-islam
SEKOLAH MENENGAH KEBANGSAAN TAMAN BUNGA RAYA (1),https://sites.google.com/moe-dl.edu.my/smkpadangtengku/bimbingan-dan-kaunseling/laman-interaktif-minda-sihat
SEKOLAH MENENGAH KEBANGSAAN SERENDAH,https://sites.google.com/moe-dl.edu.my/malledubp/delima
SEKOLAH MENENGAH KEBANGSAAN BUKIT SENTOSA 2,https://sites.google.com/moe-dl.edu.my/kemaskiniiddelimakl/home
SEKOLAH MENENGAH KEBANGSAAN MUNSHI ABDULLAH,https://sites.google.com/moe-dl.edu.my/unitbahasaprogram-pso-2021/aktiviti-unit-bahasa/aktiviti-u-bahasa-2023/bulan-januari-2023
SEKOLAH MENENGAH KEBANGSAAN SUNGAI BESAR,https://sites.google.com/moe-dl.edu.my/cikgumusli/home
SEKOLAH MENENGAH KEBANGSAAN GOMBAK SETIA,"https://sites.google.com/moe-dl.edu.my/jeldr/cpd/webinars?google_abuse=GOOGLE_ABUSE_EXEMPTION%3DID%3D9e3954e08915ee94:TM%3D1654809389:C%3D%3E:IP%3D66.249.73.43-:S%3DbiN74AZN9IoDEhfmvm9zGQ%3B+path%3D/%3B+domain%3Dgoogle.com%3B+expires%3DFri,+10-Jun-2022+00:16:29+GMT"
SEKOLAH MENENGAH KEBANGSAAN TAMAN SELAYANG,"https://sites.google.com/moe-dl.edu.my/jeldr/cpd/webinars?google_abuse=GOOGLE_ABUSE_EXEMPTION%3DID%3D9e3954e08915ee94:TM%3D1654809389:C%3D%3E:IP%3D66.249.73.43-:S%3DbiN74AZN9IoDEhfmvm9zGQ%3B+path%3D/%3B+domain%3Dgoogle.com%3B+expires%3DFri,+10-Jun-2022+00:16:29+GMT"
SEKOLAH MENENGAH KEBANGSAAN TAMAN EHSAN,https://sites.google.com/moe-dl.edu.my/digitalpsssmkbkt/laman-utama
SEKOLAH MENENGAH KEBANGSAAN RAWANG,https://sites.google.com/moe-dl.edu.my/skbtp
SEKOLAH MENENGAH KEBANGSAAN TAMAN KERAMAT,https://sites.google.com/moe-dl.edu.my/upbmjpwpkl/pegawai-teknikal/teknikal-ko-akademik-bahasa-melayu
SEKOLAH MENENGAH KEBANGSAAN SERI GOMBAK,https://sites.google.com/moe-dl.edu.my/kuizonline/quizizz/matematik
SEKOLAH MENENGAH KEBANGSAAN HILLCREST,https://sites.google.com/moe-dl.edu.my/smk-hillcrest-gsites/utama
SEKOLAH MENENGAH KEBANGSAAN TAMAN MELAWATI,https://sites.google.com/moe-dl.edu.my/smk-hillcrest-gsites/utama
SEKOLAH MENENGAH KEBANGSAAN SERI SELAYANG,https://sites.google.com/moe-dl.edu.my/pusat-sumber-smk-methodist-acs/eksplorasi-digital/e-book/koleksi-rak-buku-maya-sekolah
SEKOLAH MENENGAH KEBANGSAAN SUNGAI KERTAS,https://sites.google.com/moe-dl.edu.my/unitbahasaprogram-pso-2021/aktiviti-unit-bahasa/aktiviti-u-bahasa-2023/bulan-april-2023
SEKOLAH MENENGAH KEBANGSAAN SERI KERAMAT,https://sites.google.com/moe-dl.edu.my/ppdpekan/utama
SEKOLAH MENENGAH KEBANGSAAN DARUL EHSAN,https://sites.google.com/moe-dl.edu.my/digitalpsssmkbkt/laman-utama
SEKOLAH MENENGAH KEBANGSAAN TAMAN DESA,https://sites.google.com/moe-dl.edu.my/upbmjpwpkl/pencapaian-sekolah-sekolah/sekolah-sekolah-keramat
SEKOLAH MENENGAH KEBANGSAAN BANDAR TASIK PUTERI,https://sites.google.com/moe-dl.edu.my/perpustakaan-digital-sjkcsy/koleksi-rak-buku-maya
SEKOLAH MENENGAH KEBANGSAAN BUKIT RAHMAN PUTRA,https://sites.google.com/moe-dl.edu.my/ppd-batu-pahat-sains-matematik/laporan-aktiviti/2022
SEKOLAH MENENGAH KEBANGSAAN TAMAN DESA 2,https://sites.google.com/moe-dl.edu.my/smkabakatawau/laman-utama
SEKOLAH MENENGAH KEBANGSAAN SIERRAMAS,https://sites.google.com/moe-dl.edu.my/i-sel-nilam/home/sabak-bernam
SEKOLAH MENENGAH KEBANGSAAN TUN PERAK,https://sites.google.com/moe-dl.edu.my/unitbahasaprogram-pso-2021/aktiviti-unit-bahasa/aktiviti-u-bahasa-2022/bulan-julai-2022
SEKOLAH MENENGAH KEBANGSAAN PUCHONG,https://sites.google.com/moe-dl.edu.my/smkpuchong/berita-aktiviti/aktiviti-program-minggu-pertama-persekolahan
SEKOLAH MENENGAH KEBANGSAAN SRI PERMATA,https://sites.google.com/moe-dl.edu.my/sekolah-kebangsaan-haji-mahmud/korporat/latarbelakang
SEKOLAH MENENGAH KEBANGSAAN SUBANG JAYA,https://sites.google.com/moe-dl.edu.my/i-sel-nilam/home/petaling-perdana
SEKOLAH MENENGAH KEBANGSAAN BUKIT GADING,https://sites.google.com/moe-dl.edu.my/perpustakaan-digital-sjkcsy/koleksi-rak-buku-maya
SEKOLAH MENENGAH KEBANGSAAN SERI SERDANG,https://sites.google.com/moe-dl.edu.my/futureskillsforall-microbit/hasil-kerja-murid/pemenang-bolehcode-2021
SEKOLAH MENENGAH KEBANGSAAN TAMAN DATO' HARUN,https://sites.google.com/moe-dl.edu.my/jeldr/cpd/webinars
KOLEJ TINGKATAN ENAM PUCHONG,https://sites.google.com/moe-dl.edu.my/osct6my/
SEKOLAH MENENGAH KEBANGSAAN DAMANSARA UTAMA,https://sites.google.com/moe-dl.edu.my/smkdd1
SEKOLAH KEBANGSAAN WIRA,https://sites.google.com/moe-dl.edu.my/pdpronline/link-bahan-pdpr-skls1-j/en-amir/matematik-tahun-3
SEKOLAH KEBANGSAAN PANDAN,https://sites.google.com/moe-dl.edu.my/pdpronline/link-bahan-pdpr-skls1-j/cik-siti-nadia/bm-3-satria
SEKOLAH KEBANGSAAN BUKIT RANGIN,https://sites.google.com/moe-dl.edu.my/portalpusatsumbersekolah/laman-utama-pss
SEKOLAH KEBANGSAAN INDERA MAHKOTA UTAMA,https://sites.google.com/moe-dl.edu.my/ppdpekan/utama
SEKOLAH KEBANGSAAN SERI MAHKOTA,https://sites.google.com/moe-dl.edu.my/ppdpekan/utama
SEKOLAH KEBANGSAAN SUNGAI TALAM,https://sites.google.com/moe-dl.edu.my/portalrasmisksungairokam/home
SEKOLAH KEBANGSAAN AIR PUTIH,https://sites.google.com/moe-dl.edu.my/pdpronline/link-bahan-pdpr-skls1-j/en-yus/matematik-tahun-4
SEKOLAH KEBANGSAAN PELABUHAN,https://sites.google.com/moe-dl.edu.my/jeldr/cpd/webinars
SEKOLAH KEBANGSAAN MAT KILAU,https://sites.google.com/moe-dl.edu.my/pss-sk-bebuloh/aktiviti/laporan-aktiviti-2022
SEKOLAH KEBANGSAAN SUNGAI SOI,https://sites.google.com/moe-dl.edu.my/ustazhusni-edu-site/galeri-pdpc-xtvt/galeri-gambar
SEKOLAH KEBANGSAAN PELINDUNG,https://sites.google.com/moe-dl.edu.my/ustazhusni-edu-site/galeri-pdpc-xtvt/galeri-gambar
SEKOLAH KEBANGSAAN SERI MELATI,https://sites.google.com/moe-dl.edu.my/unitbahasaprogram-pso-2021/aktiviti-unit-bahasa/aktiviti-u-bahasa-2023/bulan-februari-2023
SEKOLAH KEBANGSAAN BELIMBING,https://sites.google.com/moe-dl.edu.my/ppdpekan/utama
SEKOLAH KEBANGSAAN NENASI,https://sites.google.com/moe-dl.edu.my/ppdpekan/utama
SEKOLAH KEBANGSAAN TANJUNG BATU,https://sites.google.com/moe-dl.edu.my/unitbahasaprogram-pso-2021/aktiviti-unit-bahasa/aktiviti-u-bahasa-2023/bulan-februari-2023
SEKOLAH KEBANGSAAN INDERA SHAHBANDAR,https://sites.google.com/moe-dl.edu.my/ppdpekan/utama
SEKOLAH KEBANGSAAN PAHANG TUA,https://sites.google.com/moe-dl.edu.my/cikgumusli/home
SEKOLAH KEBANGSAAN PULAU MANIS,https://sites.google.com/moe-dl.edu.my/smk-convent-pulau-tikus/karnival-hijau-ambang-penutupan-smkcpt
SEKOLAH KEBANGSAAN SERI BIRAM,https://sites.google.com/moe-dl.edu.my/perpustakaan-digital-sk-pedu/rak-buku-maya
SEKOLAH KEBANGSAAN PASIR PANJANG,https://sites.google.com/moe-dl.edu.my/perpustakaan-digital-sk-pedu/rak-buku-maya
SEKOLAH KEBANGSAAN TANJUNG AGAS,https://sites.google.com/moe-dl.edu.my/ppdpekan/utama
SEKOLAH KEBANGSAAN TEMAI,https://sites.google.com/moe-dl.edu.my/ppdpekan/utama
SEKOLAH KEBANGSAAN PADANG RUMBIA,https://sites.google.com/moe-dl.edu.my/ustazhusni-edu-site/galeri-pdpc-xtvt/galeri-gambar
SEKOLAH KEBANGSAAN SERAMBI,https://sites.google.com/moe-dl.edu.my/laman-rasmi-skaj/pengurusan/maklumat-asas
SEKOLAH KEBANGSAAN PELAK,https://sites.google.com/moe-dl.edu.my/kemaskiniiddelimakl/home
SEKOLAH KEBANGSAAN MAMBANG,https://sites.google.com/moe-dl.edu.my/ppdpekan/utama
SEKOLAH KEBANGSAAN TANAH PUTEH,https://sites.google.com/moe-dl.edu.my/smjktpkuantan/profil-sekolah/latar-belakang-sekolah
SEKOLAH KEBANGSAAN LEPAR,https://sites.google.com/moe-dl.edu.my/psssklu1/home/facebook-pss-separatu
SEKOLAH KEBANGSAAN KOTA PERDANA,https://sites.google.com/moe-dl.edu.my/cikgumusli/home
SEKOLAH KEBANGSAAN PERAMU JAYA,https://sites.google.com/moe-dl.edu.my/ppdpekan/utama
SEKOLAH KEBANGSAAN BANDAR 2,https://sites.google.com/moe-dl.edu.my/skbandartunrazak2/inovasi
SEKOLAH KEBANGSAAN PEKAN JAYA,https://sites.google.com/moe-dl.edu.my/sk-luagan-keningau/profil/lagu-sekolah
SEKOLAH KEBANGSAAN PULAU SERAI,https://sites.google.com/moe-dl.edu.my/pusat-sumber-smk-methodist-acs/eksplorasi-digital/e-book/koleksi-rak-buku-maya-sekolah
SEKOLAH KEBANGSAAN MUHAMMAD JABAR,https://sites.google.com/moe-dl.edu.my/ppd-batu-pahat-sains-matematik/laporan-aktiviti/2022
SEKOLAH KEBANGSAAN KUALA DONG,https://sites.google.com/moe-dl.edu.my/pdpronline/link-bahan-pdpr-skls1-j/en-wira/moral-tahun-3
SEKOLAH KEBANGSAAN TANJUNG RAJA,"https://sites.google.com/moe-dl.edu.my/jeldr/cpd/webinars?google_abuse=GOOGLE_ABUSE_EXEMPTION%3DID%3D9e3954e08915ee94:TM%3D1654809389:C%3D%3E:IP%3D66.249.73.43-:S%3DbiN74AZN9IoDEhfmvm9zGQ%3B+path%3D/%3B+domain%3Dgoogle.com%3B+expires%3DFri,+10-Jun-2022+00:16:29+GMT"
SEKOLAH KEBANGSAAN SEGA,https://sites.google.com/moe-dl.edu.my/sktamansegar/utama
SEKOLAH KEBANGSAAN ULU SUNGAI,https://sites.google.com/moe-dl.edu.my/skpa2/profil-skpa2/lencana-warna-lambang-dan-motto-sekolah
SEKOLAH KEBANGSAAN RANTAU PANJANG,https://sites.google.com/moe-dl.edu.my/kuizonline/quizizz/bahasa-inggeris
SEKOLAH KEBANGSAAN BINTANG,https://sites.google.com/moe-dl.edu.my/skbrumas-tawau/info-sekolah/logo-lagu-sekolah
SEKOLAH KEBANGSAAN LIPAT KAJANG,https://sites.google.com/moe-dl.edu.my/mypss-sk-malawa/explorasi-digital/rak-buku-maya
SEKOLAH KEBANGSAAN PAYA LUAS,https://sites.google.com/moe-dl.edu.my/cikgumusli/home
SEKOLAH KEBANGSAAN BANGAU,https://sites.google.com/moe-dl.edu.my/sktanjungkaporsemporna/perpustakaan-digital?authuser=1
SEKOLAH KEBANGSAAN BANDAR TEMERLOH,https://sites.google.com/moe-dl.edu.my/i-sel-nilam/home
SEKOLAH KEBANGSAAN KAMPUNG TENGAH,https://sites.google.com/moe-dl.edu.my/lamaninfoprisme/home
SEKOLAH KEBANGSAAN DESA BAKTI,https://sites.google.com/moe-dl.edu.my/skkemterendak2/aktiviti/2022/majlis-persaraan-guru-besar-sk-kem-terendak-ii
SEKOLAH KEBANGSAAN SERI SONGSANG,https://sites.google.com/moe-dl.edu.my/pdpronline/link-bahan-pdpr-skls1-j/en-azrul/bahasa-melayu-tahun-5
SEKOLAH KEBANGSAAN TEMERLOH JAYA,https://sites.google.com/moe-dl.edu.my/perpustakaandigitalsklb/cinta-malaysia
SEKOLAH KEBANGSAAN LANCHANG,https://sites.google.com/moe-dl.edu.my/unitbahasaprogram-pso-2021/aktiviti-unit-bahasa/aktiviti-u-bahasa-2022/bulan-sept-2022
SEKOLAH KEBANGSAAN ROMPIN,https://sites.google.com/moe-dl.edu.my/semsis-online/carian-id-delima
SEKOLAH KEBANGSAAN PONTIAN,https://sites.google.com/moe-dl.edu.my/aplikasi-sehenti-ppd-pontian/video-pendidikan
SEKOLAH KEBANGSAAN PERANTAU DAMAI,https://sites.google.com/moe-dl.edu.my/pertandingan-video-kreatif
SEKOLAH KEBANGSAAN LADANG KOTA BAHAGIA,https://sites.google.com/moe-dl.edu.my/e-pengurusansjkcnanya/pengurusan-sekolah/galeri-gambar
SEKOLAH KEBANGSAAN (FELDA) KERATONG 1,https://sites.google.com/moe-dl.edu.my/kokurikulumsmksr2021/sukan-dan-permainan
SEKOLAH KEBANGSAAN (FELDA) KERATONG 2,https://sites.google.com/moe-dl.edu.my/kokurikulumsmksr2021/sukan-dan-permainan
SEKOLAH KEBANGSAAN (FELDA) KERATONG 6,https://sites.google.com/moe-dl.edu.my/kokurikulumsmksr2021/sukan-dan-permainan
SEKOLAH KEBANGSAAN SUNGAI PUTERI,https://sites.google.com/moe-dl.edu.my/perpustakaan-digital-sjkcsy/koleksi-rak-buku-maya
SEKOLAH KEBANGSAAN MELATI,https://sites.google.com/moe-dl.edu.my/unitbahasaprogram-pso-2021/aktiviti-unit-bahasa/aktiviti-u-bahasa-2023/bulan-jun-2023
SEKOLAH KEBANGSAAN JUARA,https://sites.google.com/moe-dl.edu.my/dst2021/peringkat-kebangsaan
SEKOLAH KEBANGSAAN BANDAR TUN RAZAK,https://sites.google.com/moe-dl.edu.my/tiew-sheau-fang/utama
SEKOLAH KEBANGSAAN MUADZAM JAYA,https://sites.google.com/moe-dl.edu.my/pertandingan-video-kreatif
SEKOLAH KEBANGSAAN MUADZAM SHAH,https://sites.google.com/moe-dl.edu.my/pertandingan-video-kreatif
SEKOLAH KEBANGSAAN MARAN,https://sites.google.com/moe-dl.edu.my/psssklu1/home/sejarah-sekolah
SEKOLAH KEBANGSAAN (FELDA) JENGKA 1,https://sites.google.com/moe-dl.edu.my/skfeldajengka15/kurikulum/ts25
SEKOLAH KEBANGSAAN (FELDA) JENGKA 2,https://sites.google.com/moe-dl.edu.my/skfeldajengka15/kurikulum/ts25
SEKOLAH KEBANGSAAN KUALA WAU,https://sites.google.com/moe-dl.edu.my/pendidikan-swasta-spsjpnsabah/direktori-pegawai-ups-ppd
SEKOLAH KEBANGSAAN PAYA PASIR,https://sites.google.com/moe-dl.edu.my/ppki-batu-pahat/utama
SEKOLAH KEBANGSAAN (FELDA) JENGKA 15,https://sites.google.com/moe-dl.edu.my/skfeldajengka15/youtube
SEKOLAH KEBANGSAAN (FELDA) JENGKA 3,https://sites.google.com/moe-dl.edu.my/skfeldajengka15/kurikulum/ts25
SEKOLAH KEBANGSAAN (FELDA) JENGKA 4,https://sites.google.com/moe-dl.edu.my/skfeldajengka15/kurikulum/ts25
SEKOLAH KEBANGSAAN LKTP JENGKA 5,https://sites.google.com/moe-dl.edu.my/skfeldajengka15/kurikulum/ts25
SEKOLAH KEBANGSAAN (FELDA) JENGKA 6,https://sites.google.com/moe-dl.edu.my/skfeldajengka15/utama
SEKOLAH KEBANGSAAN (LKTP) JENGKA 7,https://sites.google.com/moe-dl.edu.my/psssklu1/home/sejarah-sekolah
SEKOLAH KEBANGSAAN (FELDA) JENGKA 8,https://sites.google.com/moe-dl.edu.my/psssklu1/home/sejarah-sekolah
SEKOLAH KEBANGSAAN BANDAR PUSAT,https://sites.google.com/moe-dl.edu.my/skbandarputra/kurikulum/dialog-prestasi
SEKOLAH KEBANGSAAN (FELDA) JENGKA 10,https://sites.google.com/moe-dl.edu.my/psssklu1/home/sejarah-sekolah
SEKOLAH KEBANGSAAN (LKTP) JENGKA 14,https://sites.google.com/moe-dl.edu.my/psssklu1/home/sejarah-sekolah
SEKOLAH KEBANGSAAN (FELDA) JENGKA 13,https://sites.google.com/moe-dl.edu.my/psssklu1/home/sejarah-sekolah
SEKOLAH KEBANGSAAN (FELDA) JENGKA 16,https://sites.google.com/moe-dl.edu.my/psssklu1/home/sejarah-sekolah
SEKOLAH KEBANGSAAN (FELDA) JENGKA 18,https://sites.google.com/moe-dl.edu.my/skfeldajengka15/aktiviti
SEKOLAH KEBANGSAAN (FELDA) JENGKA 19,https://sites.google.com/moe-dl.edu.my/psssklu1/home/sejarah-sekolah
SEKOLAH KEBANGSAAN SENTOSA,https://sites.google.com/moe-dl.edu.my/smkss/pengenalan/lagu-sekolah
SEKOLAH KEBANGSAAN (FELDA) JENGKA 22,https://sites.google.com/moe-dl.edu.my/psssklu1/home/sejarah-sekolah
SEKOLAH KEBANGSAAN JENGKA PUSAT 2,https://sites.google.com/moe-dl.edu.my/psssklu1/home/sejarah-sekolah
SEKOLAH KEBANGSAAN SERI KERAMAT,https://sites.google.com/moe-dl.edu.my/upbmjpwpkl/pegawai-teknikal
SEKOLAH KEBANGSAAN DESA JAYA,https://sites.google.com/moe-dl.edu.my/skkemterendak2/aktiviti/2021/selamat-datang-kepada-guru-besar-dan-gpk-pentadbiran
SEKOLAH KEBANGSAAN ISKANDAR,https://sites.google.com/moe-dl.edu.my/ucapanharigurudanpekerja/home
SEKOLAH KEBANGSAAN KERAYONG,https://sites.google.com/moe-dl.edu.my/portal-ibubapa-skbk/utama/profil-sekolah
SEKOLAH KEBANGSAAN BATU PAPAN,https://sites.google.com/moe-dl.edu.my/cikgumusli/home
SEKOLAH KEBANGSAAN KUALA BERA,https://sites.google.com/moe-dl.edu.my/pdpronline/link-bahan-pdpr-skls1-j/en-wira/moral-tahun-3
SEKOLAH KEBANGSAAN MENGKUANG,https://sites.google.com/moe-dl.edu.my/semsis-online/carian-id-delima
SEKOLAH KEBANGSAAN KERAYONG JAYA,https://sites.google.com/moe-dl.edu.my/portal-ibubapa-skbk/utama/profil-sekolah
SEKOLAH KEBANGSAAN SULAIMAN,https://sites.google.com/moe-dl.edu.my/skkulai1/kurikulum/program-apresiasi-graduasi-202223
SEKOLAH KEBANGSAAN SG MARONG,https://sites.google.com/moe-dl.edu.my/sistempbdbentong/home/sistem-elapor-sk
SEKOLAH KEBANGSAAN CONVENT,https://sites.google.com/moe-dl.edu.my/cbn/gallery/school-song
SEKOLAH KEBANGSAAN JERANTUT,https://sites.google.com/moe-dl.edu.my/dlime/delima-kpm/aplikasi-delima-kpm/
SEKOLAH KEBANGSAAN SULTAN ABDULLAH,https://sites.google.com/moe-dl.edu.my/unitbahasaprogram-pso-2021/aktiviti-unit-bahasa/aktiviti-u-bahasa-2023/bulan-januari-2023
SEKOLAH KEBANGSAAN ST THOMAS,https://sites.google.com/moe-dl.edu.my/pdpronline/link-bahan-pdpr-skls1-j/en-wira/sejarah-tahun-6
SEKOLAH KEBANGSAAN PEREMPUAN METHODIST,https://sites.google.com/moe-dl.edu.my/mypss-sk-malawa/explorasi-digital/rak-buku-maya
SEKOLAH KEBANGSAAN ASSUNTA CONVENT,https://sites.google.com/moe-dl.edu.my/smksaspj/tentang-kami/buku-pengurusan-sekolah
