School Name,URL
SEKOLAH KEBANGSAAN SERI MEGA,https://sites.google.com/moe-dl.edu.my/ppdpekan/utama
SEKOLAH KEBANGSAAN BKT DAMANSARA,https://sites.google.com/moe-dl.edu.my/upbmjpwpkl/pencapaian-sekolah-sekolah/sekolah-sekolah-bangsar
SEKOLAH KEBANGSAAN BUKIT PANTAI,https://sites.google.com/moe-dl.edu.my/perpustakaan-digital-sk-pedu/rak-buku-maya
SEKOLAH KEBANGSAAN BANDAR TUN RAZAK 1,https://sites.google.com/moe-dl.edu.my/perpustakaandigitalsklb/cinta-malaysia
SEKOLAH KEBANGSAAN BANDAR TUN RAZAK 2,https://sites.google.com/moe-dl.edu.my/bpsssmkbt/home
SEKOLAH KEBANGSAAN SENTUL 2,https://sites.google.com/moe-dl.edu.my/covid/home
SEKOLAH KEBANGSAAN PETALING 2,https://sites.google.com/moe-dl.edu.my/smkpuchong/berita-aktiviti/program-karnival-pendidikan-khas-daerah-petaling-perdana-2022
SEKOLAH KEBANGSAAN BANDAR BARU SERI PETALING,https://sites.google.com/moe-dl.edu.my/pdpronline/link-bahan-pdpr-skls1-j/cik-siti-nadia/bm-3-satria
SEKOLAH KEBANGSAAN SERI CHERAS,https://sites.google.com/moe-dl.edu.my/perpustakaan-digital-sjkcsy/koleksi-rak-buku-maya
SEKOLAH KEBANGSAAN BANDAR BARU SENTUL,https://sites.google.com/moe-dl.edu.my/upbmjpwpkl/pegawai-teknikal
SEKOLAH KEBANGSAAN WANGSA MAJU SEKSYEN 2,https://sites.google.com/moe-dl.edu.my/upbmjpwpkl/pusat-kokurikulum/kejurulatihan-pusat-kokurikulum
SEKOLAH KEBANGSAAN PENDIDIKAN KHAS KG BAHARU,https://sites.google.com/moe-dl.edu.my/skssujba0046/home
SEKOLAH KEBANGSAAN PENDIDIKAN KHAS JLN BATU,https://sites.google.com/moe-dl.edu.my/smkmunshiabdullahmelaka/
SEKOLAH KEBANGSAAN PENDIDIKAN KHAS JLN PEEL,https://sites.google.com/moe-dl.edu.my/upbmjpwpkl/pusat-kokurikulum/kejurulatihan-pusat-kokurikulum
SEKOLAH KEBANGSAAN TAMAN DESA,https://sites.google.com/moe-dl.edu.my/brmonline-induk-smkdp/brm-guru/bidang-sains-dan-matematik
SEKOLAH KEBANGSAAN TAMAN MALURI,https://sites.google.com/moe-dl.edu.my/upbmjpwpkl/pusat-kokurikulum/kejurulatihan-pusat-kokurikulum
SEKOLAH KEBANGSAAN AU KERAMAT,https://sites.google.com/moe-dl.edu.my/upbmjpwpkl/pencapaian-sekolah-sekolah/sekolah-sekolah-keramat
SEKOLAH KEBANGSAAN SERI PERAK,https://sites.google.com/moe-dl.edu.my/smkasas-officialsite/profil-sekolah
SEKOLAH KEBANGSAAN TAMAN SEGAR,https://sites.google.com/moe-dl.edu.my/smkpadangtengku/bimbingan-dan-kaunseling/laman-interaktif-minda-sihat
SEKOLAH KEBANGSAAN TAMAN KOPERASI POLIS,https://sites.google.com/moe-dl.edu.my/smkseribintangselatan/hubungi-kami
SEKOLAH KEBANGSAAN TAMAN TUN DR. ISMAIL (2),https://sites.google.com/moe-dl.edu.my/pssskpantaiwplabuan/rak-digital
SEKOLAH KEBANGSAAN SETIAWANGSA,https://sites.google.com/moe-dl.edu.my/upbmjpwpkl/pegawai-teknikal
SEKOLAH KEBANGSAAN TAMAN KEPONG,https://sites.google.com/moe-dl.edu.my/i-sel-nilam/home
SEKOLAH KEBANGSAAN TAMAN SERI RAMPAI,https://sites.google.com/moe-dl.edu.my/upbmjpwpkl/pegawai-teknikal/teknikal-ko-akademik-bahasa-melayu
SEKOLAH KEBANGSAAN DESA TUN HUSSEIN ONN,https://sites.google.com/moe-dl.edu.my/pssskpantaiwplabuan/rak-digital
SEKOLAH KEBANGSAAN WANGSA MELAWATI,https://sites.google.com/moe-dl.edu.my/upbmjpwpkl/pencapaian-sekolah-sekolah/sekolah-sekolah-keramat
SEKOLAH KEBANGSAAN JALAN RAJA MUDA,https://sites.google.com/moe-dl.edu.my/cikgumusli/home
SEKOLAH KEBANGSAAN MENJALARA,https://sites.google.com/moe-dl.edu.my/covid/pibg
SEKOLAH KEBANGSAAN WANGSA MAJU ZON R10,https://sites.google.com/moe-dl.edu.my/upbmjpwpkl/pegawai-teknikal
SEKOLAH KEBANGSAAN DESA SETAPAK,https://sites.google.com/moe-dl.edu.my/pusat-sumber-smk-methodist-acs/eksplorasi-digital/e-book/koleksi-rak-buku-maya-sekolah
SEKOLAH KEBANGSAAN SETAPAK INDAH,https://sites.google.com/moe-dl.edu.my/pusat-sumber-smk-methodist-acs/eksplorasi-digital/e-book/koleksi-rak-buku-maya-sekolah
SEKOLAH KEBANGSAAN TAMAN MIDAH 2,https://sites.google.com/moe-dl.edu.my/pssskpantaiwplabuan/rak-digital
SEKOLAH KEBANGSAAN DANAU KOTA,https://sites.google.com/moe-dl.edu.my/upbmjpwpkl/pegawai-teknikal
SEKOLAH KEBANGSAAN DESA PANDAN,https://sites.google.com/moe-dl.edu.my/kokusekuat/pencapaian-kokurikulum-dan-ko-akademik-sekuat/peringkat-daerah
SEKOLAH KEBANGSAAN SERI MURNI,https://sites.google.com/moe-dl.edu.my/smk-hillcrest-gsites/utama
SEKOLAH KEBANGSAAN SERI SURIA,https://sites.google.com/moe-dl.edu.my/pdpronline/link-bahan-pdpr-skls1-j/en-azrul/bahasa-melayu-tahun-5
SEKOLAH KEBANGSAAN SERI HARTAMAS,https://sites.google.com/moe-dl.edu.my/skpa2/profil-skpa2/lencana-warna-lambang-dan-motto-sekolah
SEKOLAH KEBANGSAAN BANDAR BARU SERI PETALING 2,https://sites.google.com/moe-dl.edu.my/pdpronline/link-bahan-pdpr-skls1-j/cik-siti-nadia/bm-3-satria
SEKOLAH KEBANGSAAN DESA TASIK,https://sites.google.com/moe-dl.edu.my/i-sel-nilam/home/sabak-bernam
SEKOLAH KEBANGSAAN SERI NILAM,https://sites.google.com/moe-dl.edu.my/pusatsumberseal2/utama?authuser=1
SEKOLAH KEBANGSAAN SERI INDAH,https://sites.google.com/moe-dl.edu.my/smk-hillcrest-gsites/utama
SEKOLAH KEBANGSAAN SERI KEPONG,https://sites.google.com/moe-dl.edu.my/i-sel-nilam/home
SEKOLAH KEBANGSAAN BANDAR TASIK SELATAN,https://sites.google.com/moe-dl.edu.my/upbmjpwpkl/pencapaian-sekolah-sekolah/sekolah-sekolah-pudu
SEKOLAH KEBANGSAAN DESA PETALING,https://sites.google.com/moe-dl.edu.my/smkpuchong/berita-aktiviti/kejohanan-sukan-tahunan-kali-ke-38-2022
SEKOLAH KEBANGSAAN DANAU PERDANA,https://sites.google.com/moe-dl.edu.my/upbmjpwpkl/pencapaian-sekolah-sekolah/sekolah-sekolah-bangsar
SEKOLAH KEBANGSAAN BUKIT JALIL,https://sites.google.com/moe-dl.edu.my/smkss/kurikulum/pencapaian-kokurikulum
SEKOLAH KEBANGSAAN ALAM DAMAI,https://sites.google.com/moe-dl.edu.my/pdpronline/link-bahan-pdpr-skls1-j/en-azrul/bahasa-melayu-tahun-5
SEKOLAH KEBANGSAAN SERI TASIK,https://sites.google.com/moe-dl.edu.my/pdpronline/link-bahan-pdpr-skls1-j/en-azrul/bahasa-melayu-tahun-5
SEKOLAH KEBANGSAAN INTAN BAIDURI,https://sites.google.com/moe-dl.edu.my/bpsssmkbt/pengurusan-pendidikan-khas
SEKOLAH KEBANGSAAN SERI SAUJANA,"https://sites.google.com/moe-dl.edu.my/jeldr/cpd/webinars?google_abuse=GOOGLE_ABUSE_EXEMPTION%3DID%3D9e3954e08915ee94:TM%3D1654809389:C%3D%3E:IP%3D66.249.73.43-:S%3DbiN74AZN9IoDEhfmvm9zGQ%3B+path%3D/%3B+domain%3Dgoogle.com%3B+expires%3DFri,+10-Jun-2022+00:16:29+GMT"
SEKOLAH KEBANGSAAN COCHRANE,https://sites.google.com/moe-dl.edu.my/pssskcp/utama
SEKOLAH KEBANGSAAN KIARAMAS,https://sites.google.com/moe-dl.edu.my/upbmjpwpkl/pusat-kokurikulum/kejurulatihan-pusat-kokurikulum
SEKOLAH KEBANGSAAN TAMAN MELATI,https://sites.google.com/moe-dl.edu.my/unitbahasaprogram-pso-2021/aktiviti-unit-bahasa/aktiviti-u-bahasa-2023/bulan-februari-2023
SEKOLAH KEBANGSAAN SERI ANGGERIK,https://sites.google.com/moe-dl.edu.my/upbmjpwpkl/pencapaian-sekolah-sekolah/sekolah-sekolah-pudu
SEKOLAH KEBANGSAAN COCHRANE PERKASA,https://sites.google.com/moe-dl.edu.my/pssskcp/utama
SEKOLAH KEBANGSAAN SENTUL UTAMA,https://sites.google.com/moe-dl.edu.my/covid/home
SEKOLAH KEBANGSAAN BATU MUDA,https://sites.google.com/moe-dl.edu.my/panduanpengurusanpss/pertandingan
SEKOLAH KEBANGSAAN DANAU KOTA 2,https://sites.google.com/moe-dl.edu.my/upbmjpwpkl/pusat-kokurikulum/kejurulatihan-pusat-kokurikulum
SEKOLAH KEBANGSAAN SERI PERMAISURI,https://sites.google.com/moe-dl.edu.my/kemaskiniiddelimakl/home
SEKOLAH KEBANGSAAN KEMENTAH,https://sites.google.com/moe-dl.edu.my/mycounselor/kaunseling-kerjaya
SEKOLAH KEBANGSAAN SERI BONUS,https://sites.google.com/moe-dl.edu.my/upbmjpwpkl/pencapaian-sekolah-sekolah/sekolah-sekolah-keramat
SEKOLAH KEBANGSAAN BEBULOH,https://sites.google.com/moe-dl.edu.my/pss-sk-bebuloh/aktiviti
SEKOLAH KEBANGSAAN SUNGAI BEDAUN,https://sites.google.com/moe-dl.edu.my/geopark-sksb/tentang-kami
SEKOLAH KEBANGSAAN BUKIT KALLAM,https://sites.google.com/moe-dl.edu.my/sajgetert25/laman-utama
SEKOLAH KEBANGSAAN PEKAN II WP LABUAN,https://sites.google.com/moe-dl.edu.my/skpekandua/profil-sekolah
SEKOLAH KEBANGSAAN PATAU-PATAU,https://sites.google.com/moe-dl.edu.my/skpatau-patauwplabuan/home
SEKOLAH KEBANGSAAN TANJUNG ARU,https://sites.google.com/moe-dl.edu.my/sktanjungaru1/muat-turun
SEKOLAH KEBANGSAAN PANTAI,https://sites.google.com/moe-dl.edu.my/smk-nenasi/profail-sekolah/sejarah-smkn
SEKOLAH KEBANGSAAN PUTRAJAYA PRESINT 9(1),https://sites.google.com/moe-dl.edu.my/pssskpantaiwplabuan/rak-digital
SEKOLAH KEBANGSAAN PUTRAJAYA PRESINT 8(1),https://sites.google.com/moe-dl.edu.my/webinarmgkk/webinar
SEKOLAH KEBANGSAAN PUTRAJAYA PRESINT 16(1),https://sites.google.com/moe-dl.edu.my/ubk-skpp-16-1/pendidikan-kerjaya-murid
SEKOLAH KEBANGSAAN PUTRAJAYA PRESINT 11(1),https://sites.google.com/moe-dl.edu.my/pss8teen1/utama/rak-buku-maya/sekolah-rendah-putrajaya
SEKOLAH KEBANGSAAN PUTRAJAYA PRESINT 8(2),https://sites.google.com/moe-dl.edu.my/webinarmgkk/webinar
SEKOLAH KEBANGSAAN PUTRAJAYA PRESINT 9 (2),https://sites.google.com/moe-dl.edu.my/skpp51/info-dan-makluman
SEKOLAH KEBANGSAAN PUTRAJAYA PRESINT 16 (2),https://sites.google.com/moe-dl.edu.my/panitiabahasacinaskpp161/halaman-utama?authuser=1
SEKOLAH KEBANGSAAN PUTRAJAYA PRESINT 11 (3),https://sites.google.com/moe-dl.edu.my/panitiabahasacinaskpp161/halaman-utama?authuser=1
SEKOLAH KEBANGSAAN PUTRAJAYA PRESINT 14(1),https://sites.google.com/moe-dl.edu.my/pss8teen1/utama/rak-buku-maya/sekolah-rendah-putrajaya
SEKOLAH KEBANGSAAN PUTRAJAYA PRESINT 11(2),https://sites.google.com/moe-dl.edu.my/skpp51/info-dan-makluman
SEKOLAH KEBANGSAAN PUTRAJAYA PRESINT 18(1),https://sites.google.com/moe-dl.edu.my/skpp51/info-dan-makluman
SEKOLAH KEBANGSAAN PUTRAJAYA PRESINT 18(2),https://sites.google.com/moe-dl.edu.my/skpp51/info-dan-makluman
SEKOLAH KEBANGSAAN PUTRAJAYA PRESINT 5(1),https://sites.google.com/moe-dl.edu.my/pss8teen1/utama/rak-buku-maya/sekolah-rendah-putrajaya
SEKOLAH KEBANGSAAN PUTRAJAYA PRESINT 17(1),https://sites.google.com/moe-dl.edu.my/pss8teen1/utama/rak-buku-maya/sekolah-rendah-putrajaya
SEKOLAH KEBANGSAAN PUTRAJAYA PRESINT 8 (3),https://sites.google.com/moe-dl.edu.my/panitiabahasacinaskpp161/halaman-utama?authuser=1
SEKOLAH KEBANGSAAN PUTRAJAYA PRESINT 15 (1),https://sites.google.com/moe-dl.edu.my/pss8teen1/utama/rak-buku-maya/sekolah-rendah-putrajaya
SEKOLAH KEBANGSAAN JALAN AIR PANAS,https://sites.google.com/moe-dl.edu.my/pdpronline/link-bahan-pdpr-skls1-j/cik-siti-nadia/bm-3-satria
SEKOLAH KEBANGSAAN (L) JALAN BATU,https://sites.google.com/moe-dl.edu.my/portalsmkkepongbaru/home
SEKOLAH KEBANGSAAN (P) JALAN BATU,https://sites.google.com/moe-dl.edu.my/cikgumusli/home
SEKOLAH KEBANGSAAN JALAN BELLAMY,https://sites.google.com/moe-dl.edu.my/upbmjpwpkl/pusat-kokurikulum/majlis-tertinggi-kejurulatihan-pusat-kokurikulum
SEKOLAH KEBANGSAAN BRICKFIELDS 1,https://sites.google.com/moe-dl.edu.my/sktamingjaya
SEKOLAH KEBANGSAAN BRICKFIELDS 2,https://sites.google.com/moe-dl.edu.my/sktamingjaya
SEKOLAH KEBANGSAAN SERI BINTANG UTARA,https://sites.google.com/moe-dl.edu.my/upbmjpwpkl/pencapaian-sekolah-sekolah/sekolah-sekolah-pudu
SEKOLAH KEBANGSAAN SERI BINTANG SELATAN,https://sites.google.com/moe-dl.edu.my/kemaskiniiddelimakl/home
SEKOLAH KEBANGSAAN CONVENT (1) BUKIT NANAS,https://sites.google.com/moe-dl.edu.my/upbmjpwpkl/pusat-kokurikulum/kejurulatihan-pusat-kokurikulum
SEKOLAH KEBANGSAAN CONVENT (2) BUKIT NANAS,https://sites.google.com/moe-dl.edu.my/upbmjpwpkl/pegawai-teknikal/teknikal-ko-akademik-bahasa-melayu
SEKOLAH KEBANGSAAN ST. TERESA BRICKFIELDS 1,https://sites.google.com/moe-dl.edu.my/upbmjpwpkl/pencapaian-sekolah-sekolah/sekolah-sekolah-bangsar
SEKOLAH KEBANGSAAN CONVENT JLN PEEL,https://sites.google.com/moe-dl.edu.my/siskap2022-2023/unit-beruniform/tunas-kadet-remaja-sekolah-tkrs
SEKOLAH KEBANGSAAN CONVENT SENTUL 1,https://sites.google.com/moe-dl.edu.my/upbmjpwpkl/pegawai-teknikal/teknikal-ko-akademik-bahasa-melayu
SEKOLAH KEBANGSAAN CONVENT SENTUL 2,https://sites.google.com/moe-dl.edu.my/upbmjpwpkl/pusat-kokurikulum/majlis-tertinggi-kejurulatihan-pusat-kokurikulum
SEKOLAH KEBANGSAAN MARIAN CONVENT SETAPAK,https://sites.google.com/moe-dl.edu.my/upbmjpwpkl/pencapaian-sekolah-sekolah/sekolah-sekolah-keramat
SEKOLAH KEBANGSAAN DATO ABU BAKAR,https://sites.google.com/moe-dl.edu.my/smk-hillcrest-gsites/utama
SEKOLAH KEBANGSAAN JALAN GURNEY 1,https://sites.google.com/moe-dl.edu.my/mycounselor/kaunseling-kerjaya
SEKOLAH KEBANGSAAN JALAN GURNEY 2,https://sites.google.com/moe-dl.edu.my/mycounselor/kaunseling-kerjaya
SEKOLAH KEBANGSAAN (P) METHODIST (1) BRICKFIELDS,https://sites.google.com/moe-dl.edu.my/upbmjpwpkl/pencapaian-sekolah-sekolah/sekolah-sekolah-bangsar
SEKOLAH KEBANGSAAN JALAN KUANTAN 2,https://sites.google.com/moe-dl.edu.my/cikgumusli/home
SEKOLAH KEBANGSAAN PUTERI PANDAN 1,https://sites.google.com/moe-dl.edu.my/smk-convent-pulau-tikus/karnival-hijau-ambang-penutupan-smkcpt
SEKOLAH KEBANGSAAN PUTERI PANDAN 2,https://sites.google.com/moe-dl.edu.my/smk-convent-pulau-tikus/karnival-hijau-ambang-penutupan-smkcpt
SEKOLAH KEBANGSAAN LA SALLE (1) BRICKFIELDS,https://sites.google.com/moe-dl.edu.my/upbmjpwpkl/pencapaian-sekolah-sekolah/sekolah-sekolah-bangsar
SEKOLAH KEBANGSAAN YAACOB LATIF 1,https://sites.google.com/moe-dl.edu.my/pssskpantaiwplabuan/rak-digital
SEKOLAH KEBANGSAAN LA SALLE (1) SENTUL,https://sites.google.com/moe-dl.edu.my/upbmjpwpkl/pencapaian-sekolah-sekolah/sekolah-sekolah-bangsar
SEKOLAH KEBANGSAAN METHODIST (L) JLN HANG JEBAT,https://sites.google.com/moe-dl.edu.my/upbmjpwpkl/pencapaian-sekolah-sekolah/sekolah-sekolah-bangsar
SEKOLAH KEBANGSAAN (L) METHODIST SENTUL,https://sites.google.com/moe-dl.edu.my/upbmjpwpkl/pencapaian-sekolah-sekolah/sekolah-sekolah-bangsar
SEKOLAH KEBANGSAAN PADANG TEMBAK 1,https://sites.google.com/moe-dl.edu.my/upbmjpwpkl/pegawai-teknikal/teknikal-ko-akademik-bahasa-melayu
SEKOLAH KEBANGSAAN PADANG TEMBAK 2,https://sites.google.com/moe-dl.edu.my/upbmjpwpkl/pegawai-teknikal/teknikal-ko-akademik-bahasa-melayu
SEKOLAH KEBANGSAAN JALAN PEEL,https://sites.google.com/moe-dl.edu.my/siskap2022-2023/unit-beruniform/tunas-kadet-remaja-sekolah-tkrs
SEKOLAH KEBANGSAAN (P) PUDU 1,https://sites.google.com/moe-dl.edu.my/smkss/home
SEKOLAH KEBANGSAAN ST. GABRIEL,https://sites.google.com/moe-dl.edu.my/skkemterendak2/pengurusan/kokurikulum/unit-beruniform/pengakap
SEKOLAH KEBANGSAAN ST. JOHN 1,https://sites.google.com/moe-dl.edu.my/skkemterendak2/pengurusan/kokurikulum/kelab-dan-persatuan/rukun-negara
SEKOLAH KEBANGSAAN ST. MARY,https://sites.google.com/moe-dl.edu.my/upbm/eccar/melaka-tengah/sekolah-rendah-mt
SEKOLAH KEBANGSAAN JALAN HANG TUAH 1,https://sites.google.com/moe-dl.edu.my/upbmjpwpkl/pencapaian-sekolah-sekolah/sekolah-sekolah-bangsar
SEKOLAH KEBANGSAAN JALAN SUNGEI BESI 1,https://sites.google.com/moe-dl.edu.my/pusat-sumber-smk-methodist-acs/eksplorasi-digital/e-book/koleksi-rak-buku-maya-sekolah
SEKOLAH KEBANGSAAN JALAN SUNGAI BESI 2,https://sites.google.com/moe-dl.edu.my/pusat-sumber-smk-methodist-acs/eksplorasi-digital/e-book/koleksi-rak-buku-maya-sekolah
SEKOLAH KEBANGSAAN (1) BATU 4 JALAN IPOH,https://sites.google.com/moe-dl.edu.my/mycounselor/kaunseling-kerjaya
SEKOLAH KEBANGSAAN SERI DELIMA,https://sites.google.com/moe-dl.edu.my/pusat-sumber-smk-methodist-acs/eksplorasi-digital/e-book/koleksi-rak-buku-maya-sekolah
SEKOLAH KEBANGSAAN SERI SETIA,https://sites.google.com/moe-dl.edu.my/pdpronline/link-bahan-pdpr-skls1-j/en-azrul/bahasa-melayu-tahun-5
SEKOLAH KEBANGSAAN LA SALLE 1 JINJANG,https://sites.google.com/moe-dl.edu.my/pdpronline/link-bahan-pdpr-skls1-j/pn-siti-dayana/bm-4-lestari
SEKOLAH KEBANGSAAN SALAK SOUTH,https://sites.google.com/moe-dl.edu.my/upbmjpwpkl/pencapaian-sekolah-sekolah/sekolah-sekolah-pudu
SEKOLAH KEBANGSAAN KEPONG BARU,https://sites.google.com/moe-dl.edu.my/kemaskiniiddelimakl/home
SEKOLAH KEBANGSAAN LA SALLE 2 JINJANG,https://sites.google.com/moe-dl.edu.my/pdpronline/link-bahan-pdpr-skls1-j/en-yus/matematik-tahun-4
SEKOLAH JENIS KEBANGSAAN (CINA) CHIN WOO,https://sites.google.com/moe-dl.edu.my/dpskmkluang/one-page-report-opr-1-slide-dp-sekolah
SEKOLAH JENIS KEBANGSAAN (CINA) CHONG HWA,https://sites.google.com/moe-dl.edu.my/sjkcchongkuang/%E6%A0%A1%E5%8F%B2-sejarah-sekolah/sejarah-sekolah
SEKOLAH JENIS KEBANGSAAN (CINA) CHUNG HWA 'P',https://sites.google.com/moe-dl.edu.my/ikoncikgootubekinabalu/senarai-pemenang-anugerah
SEKOLAH JENIS KEBANGSAAN (CINA) CHUNG KWO,https://sites.google.com/moe-dl.edu.my/upbmjpwpkl/pencapaian-sekolah-sekolah/sekolah-sekolah-pudu
SEKOLAH JENIS KEBANGSAAN (CINA) CONFUCIAN,https://sites.google.com/moe-dl.edu.my/upbmjpwpkl/pencapaian-sekolah-sekolah/sekolah-sekolah-bangsar
SEKOLAH JENIS KEBANGSAAN (CINA) JALAN DAVIDSON,https://sites.google.com/moe-dl.edu.my/upbmjpwpkl/pencapaian-sekolah-sekolah/sekolah-sekolah-bangsar
SEKOLAH JENIS KEBANGSAAN (CINA) IMBI,https://sites.google.com/moe-dl.edu.my/upbmjpwpkl/pencapaian-sekolah-sekolah/sekolah-sekolah-pudu
SEKOLAH JENIS KEBANGSAAN (CINA) KUNG MIN,https://sites.google.com/moe-dl.edu.my/kohingsing
SEKOLAH JENIS KEBANGSAAN (CINA) KUEN CHENG 1,https://sites.google.com/moe-dl.edu.my/upbmjpwpkl/pencapaian-sekolah-sekolah/sekolah-sekolah-bangsar
SEKOLAH JENIS KEBANGSAAN (CINA) LA SALLE,https://sites.google.com/moe-dl.edu.my/pdpronline/link-bahan-pdpr-skls1-j/en-azrul/bahasa-melayu-tahun-5
SEKOLAH JENIS KEBANGSAAN (CINA) LAI CHEE,https://sites.google.com/moe-dl.edu.my/stemocns2021sr/mathematics-online
SEKOLAH JENIS KEBANGSAAN (CINA) LAI MENG,https://sites.google.com/moe-dl.edu.my/stemocns2021sr/mathematics-online
SEKOLAH JENIS KEBANGSAAN (CINA) MUN YEE,https://sites.google.com/moe-dl.edu.my/upbmjpwpkl/pencapaian-sekolah-sekolah/sekolah-sekolah-keramat
SEKOLAH JENIS KEBANGSAAN (CINA) NAAM KHEUNG,https://sites.google.com/moe-dl.edu.my/upbmjpwpkl/pencapaian-sekolah-sekolah/sekolah-sekolah-pudu
SEKOLAH JENIS KEBANGSAAN (CINA) NAN KAI,https://sites.google.com/moe-dl.edu.my/kohingsing
SEKOLAH JENIS KEBANGSAAN (CINA) CHONG FAH PHIT CHEE,https://sites.google.com/moe-dl.edu.my/upbmjpwpkl/pencapaian-sekolah-sekolah/sekolah-sekolah-pudu
SEKOLAH JENIS KEBANGSAAN (CINA) SAM YOKE,https://sites.google.com/moe-dl.edu.my/upbmjpwpkl/pencapaian-sekolah-sekolah/sekolah-sekolah-pudu
SEKOLAH JENIS KEBANGSAAN (CINA) SENTUL,https://sites.google.com/moe-dl.edu.my/upbmjpwpkl/pencapaian-sekolah-sekolah/sekolah-sekolah-keramat
SEKOLAH JENIS KEBANGSAAN (CINA) SENTUL PASAR,https://sites.google.com/moe-dl.edu.my/upbmjpwpkl/pencapaian-sekolah-sekolah/sekolah-sekolah-pudu
SEKOLAH JENIS KEBANGSAAN (CINA) ST. TERESA BRICKFIELDS,https://sites.google.com/moe-dl.edu.my/upbmjpwpkl/pencapaian-sekolah-sekolah/sekolah-sekolah-bangsar
SEKOLAH JENIS KEBANGSAAN (CINA) TAI THUNG,https://sites.google.com/moe-dl.edu.my/upbmjpwpkl/pencapaian-sekolah-sekolah/sekolah-sekolah-pudu
SEKOLAH JENIS KEBANGSAAN (CINA) TSUN JIN,https://sites.google.com/moe-dl.edu.my/upbmjpwpkl/pencapaian-sekolah-sekolah/sekolah-sekolah-pudu
SEKOLAH JENIS KEBANGSAAN (CINA) YOKE NAM,https://sites.google.com/moe-dl.edu.my/upbmjpwpkl/pencapaian-sekolah-sekolah/sekolah-sekolah-bangsar
SEKOLAH JENIS KEBANGSAAN (CINA) CHOONG WEN,https://sites.google.com/moe-dl.edu.my/upbmjpwpkl/pencapaian-sekolah-sekolah/sekolah-sekolah-bangsar
SEKOLAH JENIS KEBANGSAAN (CINA) JINJANG TENGAH 1,https://sites.google.com/moe-dl.edu.my/pdpronline/link-bahan-pdpr-skls1-j/en-azrul/bahasa-melayu-tahun-5
SEKOLAH JENIS KEBANGSAAN (CINA) KEPONG 1,https://sites.google.com/moe-dl.edu.my/portalsmkkepongbaru/home
SEKOLAH JENIS KEBANGSAAN (CINA) KEPONG 2,https://sites.google.com/moe-dl.edu.my/portalsmkkepongbaru/home
SEKOLAH JENIS KEBANGSAAN (CINA) KWONG HON,https://sites.google.com/moe-dl.edu.my/upbmjpwpkl/pencapaian-sekolah-sekolah/sekolah-sekolah-pudu
SEKOLAH JENIS KEBANGSAAN (CINA) NAN YIK 'LEE RUBBER',https://sites.google.com/moe-dl.edu.my/upbmjpwpkl/pencapaian-sekolah-sekolah/sekolah-sekolah-keramat
SEKOLAH JENIS KEBANGSAAN (CINA) SALAK SOUTH,https://sites.google.com/moe-dl.edu.my/upbmjpwpkl/pencapaian-sekolah-sekolah/sekolah-sekolah-pudu
SEKOLAH JENIS KEBANGSAAN (CINA) JINJANG TENGAH 2,https://sites.google.com/moe-dl.edu.my/pdpronline/link-bahan-pdpr-skls1-j/en-azrul/bahasa-melayu-tahun-5
SEKOLAH JENIS KEBANGSAAN (CINA) KUEN CHENG 2,https://sites.google.com/moe-dl.edu.my/upbmjpwpkl/pencapaian-sekolah-sekolah/sekolah-sekolah-bangsar
SEKOLAH JENIS KEBANGSAAN (CINA) TAMAN CONNAUGHT,https://sites.google.com/moe-dl.edu.my/upbmjpwpkl/pencapaian-sekolah-sekolah/sekolah-sekolah-pudu
SEKOLAH JENIS KEBANGSAAN (CINA) KEPONG 3,https://sites.google.com/moe-dl.edu.my/portalsmkkepongbaru/home
SEKOLAH JENIS KEBANGSAAN (CINA) WANGSA MAJU,https://sites.google.com/moe-dl.edu.my/upbmjpwpkl/pencapaian-sekolah-sekolah/sekolah-sekolah-keramat
SEKOLAH JENIS KEBANGSAAN (TAMIL) JALAN BANGSAR,https://sites.google.com/moe-dl.edu.my/pbl-stem-bersepadu/editor
SEKOLAH JENIS KEBANGSAAN (TAMIL) CHERAS,https://sites.google.com/moe-dl.edu.my/kolokiumppdhl/2021/utama
SEKOLAH JENIS KEBANGSAAN (TAMIL) FLETCHER,https://sites.google.com/moe-dl.edu.my/upbmjpwpkl/pencapaian-sekolah-sekolah/sekolah-sekolah-keramat
SEKOLAH JENIS KEBANGSAAN (TAMIL) KG PANDAN,https://sites.google.com/moe-dl.edu.my/kolokiumppdhl/2021/utama
SEKOLAH JENIS KEBANGSAAN (TAMIL) JLN SAN PENG,https://sites.google.com/moe-dl.edu.my/upbmjpwpkl/pencapaian-sekolah-sekolah/sekolah-sekolah-pudu
SEKOLAH JENIS KEBANGSAAN (TAMIL) SENTUL,https://sites.google.com/moe-dl.edu.my/upbmjpwpkl/pencapaian-sekolah-sekolah/sekolah-sekolah-keramat
SEKOLAH JENIS KEBANGSAAN (TAMIL) VIVEKANANDA,https://sites.google.com/moe-dl.edu.my/upbmjpwpkl/pencapaian-sekolah-sekolah/sekolah-sekolah-bangsar
SEKOLAH JENIS KEBANGSAAN (TAMIL) LADANG BUKIT JALIL,https://sites.google.com/moe-dl.edu.my/budaya-penyelidikan-melaka/contoh-penulisan
SEKOLAH JENIS KEBANGSAAN (TAMIL) SARASWATHY,https://sites.google.com/moe-dl.edu.my/upbmjpwpkl/pencapaian-sekolah-sekolah/sekolah-sekolah-bangsar
SEKOLAH JENIS KEBANGSAAN (TAMIL) SG BESI,https://sites.google.com/moe-dl.edu.my/upbmjpwpkl/pencapaian-sekolah-sekolah/sekolah-sekolah-bangsar
SEKOLAH JENIS KEBANGSAAN (CINA) CHUNG HWA,https://sites.google.com/moe-dl.edu.my/ikoncikgootubekinabalu/senarai-pemenang-anugerah
SEKOLAH MENENGAH KEBANGSAAN TAMAN BUKIT MALURI,https://sites.google.com/moe-dl.edu.my/upbmjpwpkl/pegawai-teknikal/teknikal-ko-akademik-bahasa-melayu
SEKOLAH MENENGAH KEBANGSAAN SUNGAI BESI,https://sites.google.com/moe-dl.edu.my/pusat-sumber-smk-methodist-acs/eksplorasi-digital/e-book/koleksi-rak-buku-maya-sekolah
SEKOLAH MENENGAH KEBANGSAAN AMINUDDIN BAKI,https://sites.google.com/moe-dl.edu.my/pendidikan-swasta-spsjpnsabah
SEKOLAH MENENGAH KEBANGSAAN PUTERI WILAYAH,https://sites.google.com/moe-dl.edu.my/smkss/pengenalan/latar-belakang/senarai-pengetua
KOLEJ TINGKATAN ENAM PUDU JAYA,https://sites.google.com/moe-dl.edu.my/osct6my/
SEKOLAH MENENGAH KEBANGSAAN PADANG TEMBAK,https://sites.google.com/moe-dl.edu.my/upbmjpwpkl/pegawai-teknikal/teknikal-ko-akademik-bahasa-melayu
SEKOLAH MENENGAH KEBANGSAAN PETALING,https://sites.google.com/moe-dl.edu.my/smkss/home
SEKOLAH MENENGAH KEBANGSAAN RAJA ALI,https://sites.google.com/moe-dl.edu.my/cikgumusli/home
SEKOLAH MENENGAH SAINS SELANGOR,https://sites.google.com/moe-dl.edu.my/belajargcsifukz/e-rph-gc/sekolah-bimbingan-e-rph-gc
SEKOLAH MENENGAH KEBANGSAAN KEPONG BARU,https://sites.google.com/moe-dl.edu.my/kokusekuat/pencapaian-kokurikulum-dan-ko-akademik-sekuat/peringkat-daerah
SEKOLAH MENENGAH KEBANGSAAN TAMAN TUN DR. ISMAIL,https://sites.google.com/moe-dl.edu.my/upbmjpwpkl/pencapaian-sekolah-sekolah/sekolah-sekolah-bangsar
SEKOLAH MENENGAH KEBANGSAAN PENDIDIKAN KHAS SETAPAK,https://sites.google.com/moe-dl.edu.my/tkrs-skblb/informasi/sejarah
SEKOLAH MENENGAH KEBANGSAAN TAMAN DESA,https://sites.google.com/moe-dl.edu.my/upbmjpwpkl/pencapaian-sekolah-sekolah/sekolah-sekolah-pudu
SEKOLAH MENENGAH KEBANGSAAN BUKIT BANDARAYA,https://sites.google.com/moe-dl.edu.my/smkseripantai
SEKOLAH MENENGAH KEBANGSAAN WANGSA MAJU SEKSYEN 2,https://sites.google.com/moe-dl.edu.my/upbmjpwpkl/pencapaian-sekolah-sekolah/sekolah-sekolah-keramat
SEKOLAH MENENGAH KEBANGSAAN ZON R1 WANGSA MAJU,https://sites.google.com/moe-dl.edu.my/upbmjpwpkl/pegawai-teknikal/teknikal-ko-akademik-bahasa-melayu
SEKOLAH MENENGAH KEBANGSAAN TAMAN CONNAUGHT,https://sites.google.com/moe-dl.edu.my/upbmjpwpkl/pencapaian-sekolah-sekolah/sekolah-sekolah-pudu
SEKOLAH MENENGAH KEBANGSAAN BANDAR BARU SENTUL,https://sites.google.com/moe-dl.edu.my/upbmjpwpkl/pencapaian-sekolah-sekolah/sekolah-sekolah-bangsar
SEKOLAH MENENGAH KEBANGSAAN BANDAR BARU SERI PETALING,https://sites.google.com/moe-dl.edu.my/smkss/home
SEKOLAH MENENGAH KEBANGSAAN TAMAN YARL,https://sites.google.com/moe-dl.edu.my/misi-60-hari-spm/musim-1-minggu-3
SEKOLAH MENENGAH KEBANGSAAN SERI HARTAMAS,https://sites.google.com/moe-dl.edu.my/upbmjpwpkl/pencapaian-sekolah-sekolah/sekolah-sekolah-bangsar
SEKOLAH MENENGAH KEBANGSAAN TAMAN SERI RAMPAI,https://sites.google.com/moe-dl.edu.my/upbmjpwpkl/pencapaian-sekolah-sekolah/sekolah-sekolah-keramat
SEKOLAH MENENGAH KEBANGSAAN BANDAR TUN RAZAK,https://sites.google.com/moe-dl.edu.my/e-pengurusansjkcnanya/home
SEKOLAH MENENGAH KEBANGSAAN DESA PERDANA,https://sites.google.com/moe-dl.edu.my/smkpuchong/berita-aktiviti/kejohanan-merentas-desa-kali-ke-39
SEKOLAH MENENGAH KEBANGSAAN TAMAN MELATI,https://sites.google.com/moe-dl.edu.my/unitbahasaprogram-pso-2021/aktiviti-unit-bahasa/aktiviti-u-bahasa-2023/bulan-februari-2023
SEKOLAH MENENGAH KEBANGSAAN SEKSYEN 5 WANGSA MAJU,https://sites.google.com/moe-dl.edu.my/upbmjpwpkl/pencapaian-sekolah-sekolah/sekolah-sekolah-keramat
SEKOLAH MENENGAH KEBANGSAAN DESA TUN HUSSEIN ONN,https://sites.google.com/moe-dl.edu.my/upbmjpwpkl/pencapaian-sekolah-sekolah/sekolah-sekolah-pudu
SEKOLAH MENENGAH KEBANGSAAN MENJALARA,https://sites.google.com/moe-dl.edu.my/covid/pibg
SEKOLAH MENENGAH KEBANGSAAN WANGSA MELAWATI,https://sites.google.com/moe-dl.edu.my/upbmjpwpkl/pencapaian-sekolah-sekolah/sekolah-sekolah-keramat
SEKOLAH SUKAN BUKIT JALIL,https://sites.google.com/moe-dl.edu.my/gerbangdigitalpendidikanislam/ju-digital-learning
